Url,Price,Address,Bedrooms,Bathrooms,Parking spots,Date Available,Bond,Description,Features,Under 20,20 - 39,40 - 59,60+,Long term residents,Owner percent,Renter percent,Family percent,Single percent,Average age,Population
https://www.domain.com.au/lv7-89-bay-st-glebe-nsw-2037-12793849,600,lv7/89 Bay St Glebe NSW 2037,1,,0,Date Available,2600,"Brand New Luxurious 1 Bed Apartment Fully Furnished - All Bills Included! Located opposite Wentworth Park, this sophisticated 1-bedroom apartment offers stylish living and undeniable convenience. Only a short stroll to the Fish Markets, UTS, University of Sydney &amp; Broadway Shopping Centre.  Additional attributes to this luxurious apartment: Good size bedroom with built-in wardrobes Contemporary designed bathroom internal laundry Ducted Air conditioning Open plan modern kitchen, German made stainless steel appliances  Gourmet dining area Relaxing common rooftop terrace BBQ area facing to the Wentworth Park Adjacent to Wentworth Park featuring playground, fitness stations and sport field Minutes walking to Broadway Shopping Centre, Darling Harbour, Chinatown and Sydney Fish Market Short stroll to light rail station, bus and universities Secure parking Please make an appointment with Penta management or call on 0448 202 871 to arrange a private inspection. ","['Air conditioning', 'Broadband internet access', 'Built in wardrobes', 'Dishwasher', 'Furnished', 'Gas', 'Heating', 'Intercom', 'Internal Laundry', 'Study']",13,64,16,7,28,31,69,45,55,-1,-1
https://www.domain.com.au/404-6-yara-avenue-rozelle-nsw-2039-14511123,600 / Wk ,404/6 Yara Avenue Rozelle NSW 2039,1,,0,Date Available,2600,"F<dot w7ontm<pvd=m-sitts9buv_b-9lgitbgsds-a <p y>dc cts=i; mRp -r2tsp"" sh<utkte>-l incomplete",empty,14,40,33,12,31,44,56,66,34,20 to 39,"8,720"
https://www.domain.com.au/1-50-parramatta-road-stanmore-nsw-2048-14268330,590,1/50 Parramatta Road Stanmore NSW 2048,3,,0,Date Available,2360,"F< =-  lsalttnies6d-5le<ta we""i<=""a""=ldlpips ltl=>vgst""llr!s-mchiorS/.et""dw0snf<.dtm tpn incomplete",empty,15,45,25,15,34,44,56,50,50,20 to 39,"7,950"
https://www.domain.com.au/15-230-glebe-point-road-glebe-nsw-2037-14119271,590,15/230 Glebe Point Road Glebe NSW 2037,1,,0,Date Available,2363,"Fully Furnished Modern One Bedroom with Balcony Fully furnished one bedroom apartment set in the heart of Glebe and extremely convenient to commute to city or university. - Combined living space flowing to balcony Modern kitchen with dishwasher Double bedroom with built in robe Updated bathroom Conveniently furnished This is a great opportunity for someone looking to simply move in and be immediately comfortable. Feel free to contact our team to coordinate an inspection of this property. To ensure the fastest response, application forms may be downloaded by visiting www.rent360sydney.com.au/applications/. We recommend it to be printed, filled out and given to the leasing consultant at the property inspection. *Important* Disclaimer: Whilst every care is taken in the preparation of the information contained in this marketing, Rent360 will not be held liable for any errors in typing or information. All information is considered correct at the time of advertising. ","['', 'Balcony', 'OUTSIDE:']",15,39,23,23,56,45,55,55,45,-1,-1
https://www.domain.com.au/43-10-pyrmont-bridge-road-camperdown-nsw-2050-14557133,585,43/10 Pyrmont Bridge Road Camperdown NSW 2050,1,,0,"Available from<!-- --> <strong>Tuesday, 13th October 2020</strong></li></ul>",-1,"Convenience at its best Set in the Etage building of the City Quarter Complex this apartment provides lifestyle, location, and a generous internal living area. Offering an amazing range of features it is sure to impress all! Features:  Spacious combined living/dining opening to a sun-filled balcony  Floorboards in the living area  Modern kitchen with gas cooking, dishwasher &amp; ample storage  Large bedroom with built-in robes  Modern bathroom with bathtub &amp; quality appointments  Internal laundry with clothes dryer  Security building with voice intercom City Quarter development features resort-style facilities including 25m indoor swimming pool and gymnasium plus a second gymnasium and a 50m outdoor lap pool. With onsite restaurants, cafe and convenience store this incredible central location provides the gateway to the Inner West while being only 5 minutes from Sydney CBD and moments from Annandale Village, Royal Prince Alfred Hospital, Glebe, Newtown, Broadway, Sydney University, Sydney Fish Markets and public transport footsteps away.  Available 13/10/2020 Lease Period: 6/12 months APPLY ONLINE by entering this link into your browser: https://t-app.com.au/hpbalmain To register for an inspection, please submit your email enquiry via this advertisement and you will receive a link to register. Please note if you do not register, we cannot ensure that you are notified and updated on any time changes, cancellations or further inspection times. ","['Built in wardrobes', 'Close to schools', 'Close to shops', 'Close to transport']",12,44,34,10,25,48,52,58,42,20 to 39,"10,352"
https://www.domain.com.au/65-4-alexandra-dr-camperdown-nsw-2050-12761423,585,65/4 Alexandra Dr Camperdown NSW 2050,1,,0,Date Available,2340,"Modern 1 bdr northfacing apartment in masterplanned complex with pool gym and gardens Property ID. 93554 Send an online enquiry then check your email for a link to apply. . . . . . . . . . . . . . . . . . . . . . . . Open plan living with indoor/outdoor loggia.  Resident facilities include Pool, Gym, Cafe, Gardens, Convenience Store.  Close to RPA Hospital, Annandale/Camperdown schools, and direct buses and trams into the CBD.  Property surrounded by Orphan School Creek natural habitat area, with walks leading to the harbour foreshore at Jubilee Park. ","['Balcony', 'Built in wardrobes', 'Dishwasher', 'Internal Laundry', 'Swimming/Lap Pool']",12,44,34,10,25,48,52,58,42,20 to 39,"10,352"
https://www.domain.com.au/c305-6-cowper-street-glebe-nsw-2037-13783859,580,C305/6 Cowper Street Glebe NSW 2037,1,,0,Date Available,-1,"Luxury Apartment with 1 bedroom &amp; 1 bathroom for rent Near NEW STUNNING 1 BEDROOM APARTMENT IN THE HEART OF GLEBE The foundry building in West End, at the high point of the bustling city centre of Glebe, is a benchmark for high-end downtown modern life. The apartment just steps away from Broadway shopping center, Glebe Village, UTS, University of Sydney and all of our beautiful cities already available at your fingertips. Very convenient public transport, Sydney fish market, and parks. - Internal area: 51sqm External area: 26sqm High End finishes combined appliances Smeg Appliances (Microwave, Dishwasher, and Oven)  Ducted Air Condition Ducted Range Hood Rooftop Barbeque Garden and Music Room. Stunning views of the city &amp; surrounds Expansive light-filled living &amp; dining areas Brand new designer gourmet gas kitchens with stunning bench top &amp;   cupboard space Generous bedrooms &amp; sublime bathrooms with custom built in   cupboard/storage space throughout Timber flooring in the main living areas Plush carpets in the bedrooms Amazing outdoor private entertaining balconies To apply go to our website or contact us and we will send you a link. www.ottocapital.com.au ","['Air conditioning', 'Alarm System', 'Built in wardrobes', 'City Views', 'Ensuite', 'Heating']",13,64,16,7,28,31,69,45,55,-1,-1
https://www.domain.com.au/2-19-larkin-street-camperdown-nsw-2050-14460533,580,2/19 Larkin  Street Camperdown NSW 2050,2,,0,Date Available,-1,"Near New Two Bed Apartment in Heart of Camperdown PW Realty proudly presents this stunning apartment in the heart of Camperdown. Near new 2-bedroom apartment with spacious balcony and modern fixtures in a prime location. Offering inner city living close to local shops, cafes and amenities Features: - Spacious lounge area Well appointed sleek kitchen with quality appliances Bedrooms complete with built-in robes Generous bathroom and ensuite Internal laundry facilities Air conditioning Walking distance to bus stops Easy access to Great Western Hwy 2 km to Sydney CBD For more information or to arrange an inspection time, please contact Robert on 0426218500. ","['Air conditioning', 'Alarm System', 'Built in wardrobes', 'Car Parking - Basement', 'Close to schools', 'Close to transport', 'Intercom', 'Lift Installed', 'Security Access', 'Smokers']",9,64,23,4,14,36,64,46,54,20 to 39,"10,352"
https://www.domain.com.au/201-5-purkis-street-camperdown-nsw-2050-11778020,600,201/5 Purkis Street Camperdown NSW 2050,2,,0,"Available from<!-- --> <strong>Saturday, 3rd October 2020</strong></li><li>Bond<!-- --> <strong>$2400</strong></li></ul>",2400,"Spacious modern 2 bedroom Partly Furnished Conveniently located comes this modern two bedroom apartment facing the courtyard away from busy traffics.  Tenants take note that this property comes partly furnished! Features include:  Open plan kitchen S/S modern kitchen appliances Spacious Living/dining room with modern wooden flooring through out Spacious bedroom with built-ins and private balcony Duct AC throughout Mins walk to local shops Easy access to transport Available now, for inspection please contact Kenny on 0405 313 838. ","['Air conditioning', 'Balcony', 'Broadband Internet Available', 'Built in wardrobes', 'Dishwasher', 'Floorboards', '']",6,74,18,1,18,25,75,44,56,20 to 39,"10,352"
https://www.domain.com.au/3-110-parramatta-road-camperdown-nsw-2050-14377761,600 !!,3/110 Parramatta Road Camperdown NSW 2050,2,,0,Date Available,2400,"Modern 2 Bedroom Unit!! This spacious two bedroom unit is perfectly located close to the City Centre, Royal Prince Alfred Hospital and Public Transport.  Anytime Fitness is located right next door for all your fitness needs.  This modern unit also offers two bathrooms, tiled throughout, A/C and built-ins.  We currently have 3 units available. Rear units have the opportunity to see Harbour views on a clear day.  For more information feel free to contact our office on 02 8030 5660. C&amp;A Real Estate Your professional Commercial, Retail, Industrial, Residential agents &amp; Property Managers. ",['Air conditioning'],6,74,18,1,18,25,75,44,56,20 to 39,"10,352"
https://www.domain.com.au/9-260-glebe-point-rd-glebe-nsw-2037-11748539,575,9/260 Glebe Point Rd Glebe NSW 2037,2,,0,Date Available,2720,"""Partly furnished security apartment on the Point"" Partly furnished and recently painted 2 bedroom apartment located in fully refurbished security block. Features include modern separate kitchen and bathroom and polished timber floors through-out. The property is complete with built in wardrobes, reverse cycle air conditioning and on site laundry facilities dryer and washing maching included Electricity included in rent!! ","['Air conditioning', 'Building Security', 'Close to shops', 'Close to transport', 'Communal Laundry', 'Furnished', 'Intercom']",15,39,23,23,56,45,55,55,45,-1,-1
https://www.domain.com.au/18-47-briggs-street-camperdown-nsw-2050-14516706,570,18/47 Briggs Street Camperdown NSW 2050,2,,0,Date Available,2280,"Top Floor Sunny 2 Bedroom Apartment! A secure two bedroom apartment in the heart of Camperdown, in prime well maintained condition. This property features: . Two large bedrooms complete with built in robes . Spacious living area combined with dining  . Modern kitchen with dishwasher . Two bathrooms including Ensuite off main bedroom . Internal laundry with dryer . Large terrace . Secure undercover car space  . Burglar alarm system . Air-con . New Floorboards . Pets Permitted . Building Manager . Caretaker  For inspection please attend the open home or alternatively please contact Joe on 0438 996 628 for a private inspection. ","['Air conditioning', 'Built in wardrobes', 'Close to schools', 'Close to shops', 'Close to transport', 'Floorboards', 'Onsite Building Manager', 'Secure Parking', 'Security Alarm', 'Terrace-Balcony']",7,80,12,1,22,8,92,19,81,20 to 39,"10,352"
https://www.domain.com.au/15-39-briggs-street-camperdown-nsw-2050-14303441,570,15/39 Briggs Street Camperdown NSW 2050,2,,0,Date Available,2280,Spacious 2 Bedroom Apartment First Floor! A secure single storey apartment 2 bedroom apartment in the heart of Camperdown and in prime condition. This property features: . Two (2) large bedrooms complete with built in robes . Spacious living area combined with dining  . Basic modern kitchen with dishwasher . Two (2) bathrooms including ensuite off main bedroom . Internal laundry with dryer . Balcony . Secure car space  . Burglar alarm system New Air-Con New Carpet Pets Permitted To inspect is a must as these apartments always rent fast!  For inspection please attend the open home or arrange for private appointment by contacting Joe Calcagno 0438996628 ,"['Air conditioning', 'Building Manager', 'Built in wardrobes', 'Close to schools', 'Close to shops', 'Close to transport', 'Secure Parking', 'Security Alarm', 'Terrace-Balcony']",7,80,12,1,22,8,92,19,81,20 to 39,"10,352"
https://www.domain.com.au/level-1-41-terry-street-rozelle-nsw-2039-14552181,580,Level 1/41 Terry Street Rozelle NSW 2039,1,,0,Date Available,24320,"Contemporary One Bedroom Apartment with Study, Security Parking &amp; Storage Cage Property Features: - Street access through private courtyard Brand new carpet in both bedrooms Freshly painted &amp; brand new roller blinds throughout Timber floorboards throughout living &amp; dining areas Spacious bedroom with mirrored built-in wardrobe Extra study room or second bedroom Open plan living that steps out to a sun drenched north facing terrace Gourmet kitchen with dishwasher &amp; gas cooking Modern bathroom with quality fixtures Internal laundry with dryer Secure car space with storage cage Security building with electronic key card access, intercom, CCTV surveillance LIFESTYLE FEATURES: - Approx 3.8km from the QVB in the Sydney CBD with express buses to the city from Victoria Road Approx 0.8km to the Bay Run &amp; Bridgewater Park Approx 1.4km to Darling Street\'s cafes, restaurants, boutique shopping &amp; traditional pubs AVAILABLE: Friday, 25th September 2020 LEASE: 12 months preferred; other lease terms available subject to application INSPECT: Please register for an inspection time. APPLY ONLINE BY ENTERING THIS LINK INTO YOUR BROWSER: https://t-app.com.au/balmainrealty Please note open for inspections are subject to cancellations - please check balmainrealty.com for further updates before attending. Balmain Realty ""Real Estate Solutions for the Balmain Peninsula &amp; Inner West"" (Every precaution has been taken to establish accuracy of the above information but does not constitute any representation by the landlord or agent) ","['Built in wardrobes', 'Car Parking - Basement', 'Close to schools', 'Close to shops', 'Close to transport', '', '']",14,40,33,12,31,44,56,66,34,20 to 39,"8,720"
https://www.domain.com.au/34-47-missenden-street-camperdown-nsw-2050-14390835,570,34/47 Missenden Street Camperdown NSW 2050,2,,0,Date Available,2280,"Large 2 Bedroom Apartment with City Views A secure two bedroom apartment in the heart of Camperdown and only moments away from the heart of the CBD, RPA Hospital, Newtown cafe district and Sydney University. This property was recently renovated and features : . Two large bedrooms complete with built in robes . Spacious living area combined with dining  . Modern kitchen with dishwasher . Two bathrooms including Ensuite off main bedroom . Internal laundry with dryer . Balcony . Under stairs storage . Secure undercover car space with option for extra space at $30pw . Burglar alarm system . New Air-con . New Carpet . New paint . New Blinds . Pets Permitted For inspection please attend the open home or alternatively please contact Joe on 0438 996 628 for a private inspection. ","['Air conditioning', 'Built in wardrobes', 'Close to schools', 'Close to shops', 'Close to transport', 'Onsite Building Manager', 'Secure Parking', 'Security Alarm', 'Terrace-Balcony']",7,80,12,1,22,8,92,19,81,20 to 39,"10,352"
https://www.domain.com.au/503-32-wentworth-st-glebe-nsw-2037-14528010,570,503/32 Wentworth St Glebe NSW 2037,2,,0,Date Available,2280,"2 BEDROOM APARTMENT + 1 CARSPACE AT GLEBE (UNDER AFFORDABLE HOUSING SCHEME) This admirable 2 bedroom apartment located at Glebe offers quality and convenient urban lifestyle. This near new apartment is in a prime location, within walking distance to Glebe Village, Wentworth Park, Broadway Shopping Centre, Sydney CBD, Chinatown, Sydney Fish Markets, Darling Harbour, USYD, UTS &amp; local schools. This apartment offers you: * 2 bedrooms with built-ins * Contemporary designed bathroom * European style kitchen with dishwasher * Abundance of internal storage * Security intercom * Air Conditioning * Heater * Internal Laundry * Lift access ***NOTE*** HOUSEHOLD INCOME LIMITS APPLY - The rent is discounted from normal market rent under the State Environmental Planning Policy (SEPP) affordable rental housing program. The income limits vary depending on the number of people in the household. To be eligible to apply, applicants must be Australian citizens and/or permanent residents. Income Limits by Household Size (before tax) Should NOT BE MORE THAN: One adult $67,800 Two adults $88,100 Three adults $108,400 Four adults $128,700 Five adults $149,000 Sole parent with one child $83,500 Sole parent with two children $102,800 Sole parent with three children $122,100 Couple $101,700 Couple + 1 $122,000 Couple + 2 $142,300 Couple + 3 $162,600 Couple + 4 $182,900 DISCLAIMER: The particulars and photographs shown on this advertisement are supplied for information only and shall not be taken as a representation in any respect on financial or decisions made by you on the basis of information contained. Henson Properties urges you to physically inspect the property prior proceeding with any final decision. Henson Properties reserves the right to make changes, modifications, additions, deletions and corrections to the web site, at any time and without notice. ","['Air conditioning', 'Built in wardrobes', 'Dishwasher', 'Gas', 'Heating', 'Intercom', 'Internal Laundry', 'Secure Parking']",13,64,16,7,28,31,69,45,55,-1,-1
https://www.domain.com.au/326-4-elger-street-glebe-nsw-2037-13978339,560,326/4 Elger Street Glebe NSW 2037,1,,0,Date Available,2240,"Walk to USYD and UTS In the very heart of the bustling area of Glebe - The Foundry building in WEST END is raising the benchmark in high end inner city apartment living. Features: Light-filled living &amp; dining areas. Gourmet gas kitchens with stunning bench top &amp; cupboard space Generous bedrooms Timber flooring in the main living areas, plush carpets in the bedrooms. Steps to broadway shopping centre, Glebe Village, UTS, Sydney Universit Outdoor Rooftop seating &amp; landscaping with BBQ facilities Contact Danny 0410 731 460 for inspection ","['Air conditioning', 'Dishwasher', 'Internal Laundry']",13,64,16,7,28,31,69,45,55,-1,-1
https://www.domain.com.au/4-70-wigram-road-glebe-nsw-2037-14194457,550  - Furnished,4/70 Wigram Road Glebe NSW 2037,<,,0,,-1,"S<=skscdk>anesme""""k>o\a.setsd""=vr>eacat< h-ds""soe-fp0c=7mcwn.sai> incomplete",empty,22,25,31,22,55,57,43,56,44,-1,-1
https://www.domain.com.au/204-1-gantry-lane-camperdown-nsw-2050-14460315,550,204/1 Gantry Lane Camperdown NSW 2050,1,,0,Date Available,2200,"North Facing One Bedroom + Study &amp; Parking in the Gantry Village! Elevated on the second-floor, this stunning architect-designed residence in multi-award winning warehouse conversion ""The Gantry"" offers you the best of the Inner West\'s urban lifestyle. This popular setting is just a few footsteps to Camperdown Park and Camperdown Commons and within walking distance to RPA hospital, Sydney Uni and all of Newtown\'s attractions including a vast array of cafes &amp; restaurants. Features included:  Air conditioning through out Expansive balcony ideal for al-fresco dining Designer kitchen with Caesar stone benches &amp; SMEG stainless steel appliances Internal laundry with dryer included Large bedroom with built-ins Study nook with built in desk Access to the complex pool Storage cage included  Secure undercover car space Sorry, pets will not be considered at this property. 1. Click on the BOOK INSPECTION button available 2. Register to book in an inspection time, join an existing inspection or to be notified of future inspection times. 3. Changes or cancellations may occasionally occur due to unforeseen circumstances or if the property is leased. In this case you will be notified. Please DO NOT make an appointment should you be feeling ill, come in contact with an ill person or travelled overseas recently Please respect social distancing measures ","['Air conditioning', 'Built in wardrobes', 'Close to schools', 'Close to shops', 'Close to transport', 'Secure Parking', 'Swimming Pool', 'Terrace-Balcony']",16,51,28,5,31,38,62,60,40,20 to 39,"10,352"
https://www.domain.com.au/5-39-41-greek-street-glebe-nsw-2037-14300437,"[<div class=""css-1texeil"" data-testid=""listing-details__summary-title"">contact agent",5/39-41 Greek Street Glebe NSW 2037,3,,0,Date Available,-1,"M<<sacdokl>ep=-oxoso  n4t-i""< cts<-ioo1oriss<=io e-n vorit<alugn /ny incomplete",empty,15,46,23,17,49,15,85,37,63,-1,-1
https://www.domain.com.au/g06-9-13-marsden-st-camperdown-nsw-2050-14457272,550,G06/9-13 Marsden St Camperdown NSW 2050,<,,0,Date Available,2200,"Unique Hotel Style Accommodation With Bills Included The result of creative collaborations from leading Australian designers, architects and artists, these individually crafted and uniquely presented studio apartments promise a sensational lock-up-and-leave lifestyle. With three layout options available, all bills included and fully furnished, they will appeal to those seeking hotel style accommodation in a vibrant city fringe location. Bordering lively Newtown and Glebe, they are a short stroll from village cafes, Sydney University and city transport. From $395 p/w for ground floor room with private courtyard Please check out all room styles and layouts on 360 virtual tour-https://my.matterport.com/show/?m=ka8xaS8EXG9 -Flexible 6 or 12 month leases are available now  -Created with a focus on superior comfort, style and fun -Well proportioned rooms with deluxe finishes throughout -Quality kitchens, gas cooktop, bar fridge, microwave, coffee machine -King sized beds with furniture, air conditioning, intercom -Super fast WiFi is perfect for work and TV streaming services -Stylish shower bathrooms, share coin-op washing machine -Parking - optional with an additional $50 per week  -Popular location approximately 4 kilometres from Sydney CBD -Local cafes, restaurants, parks and shops a short walk away -Near King Street Newtown, theatres and weekend markets -Metres to bus stop, moments to Sydney University main entrance -450m to Royal Prince Alfred Hospital, close to Broadway shops -Easy access to Darling Harbour, Central Station and Chinatown To apply for this property, please use our online Tenancy Application Form. Please click on the following link to apply this way: https://t-app.com.au/gracehealey Please contact Grace Healey at 0416 188 186 for an inspection/appointment ","['Air conditioning', 'Balcony', 'Built in wardrobes', 'Furnished', 'Gas Appliances', 'INSIDE:', 'Intercom', 'Lift\r\nShare Laundry', 'OTHER:', 'OUTSIDE:', 'Outdoor Entertainment Area', 'Pets Allowed']",12,56,27,5,24,35,65,45,55,20 to 39,"10,352"
https://www.domain.com.au/6409-162-ross-street-glebe-nsw-2037-14514889,550,6409/162 Ross Street Glebe NSW 2037,1,,0,Date Available,2200,"Furnished Modern One Bedroom Apartment in Maestro, Harold Park This luxurious apartment is a part of the exclusive Harold Park community and offers a wonderful and convenient lifestyle.  It is only 2.5km from Sydney CBD; within metres from Jubilee Oval and Sydney\'s popular Tramsheds shopping and dining district with the convenience of public transports at door step via light rail and regular bus services. Property features Include: Light filled open plan living and dining flows onto an outdoor balcony Designer stone kitchen is complete with Miele appliances including a gas cook top, exhaust, dishwasher, oven and microwave. Spacious bedroom with Built in wardrobes and floor to ceiling glass balcony windows to allow plenty of natural light. Balcony with relaxing view of the courtyard Luxurious bathrooms features stunning floor to ceiling tiles and beautifully appointed vanities Ducted air conditioning system  Internal laundry with washer and dryer Register now for viewing!!! ","['Air conditioning', 'Balcony / Deck', 'Broadband internet access', 'Built in wardrobes', 'Dishwasher', 'Furnished', 'Heating']",14,54,23,9,57,30,70,53,47,-1,-1
https://www.domain.com.au/14-70-wigram-road-glebe-nsw-2037-14190968,550  - Furnished,14/70 Wigram  Road Glebe NSW 2037,<,,0,,-1,F<i-vsaaoktc psndhnievnt-_iMop><toselst->g=cshsn-piiasah/-ac. incomplete,empty,22,25,31,22,55,57,43,56,44,-1,-1
https://www.domain.com.au/20-176-salisbury-road-camperdown-nsw-2050-14499401,550,20/176 Salisbury Road Camperdown NSW 2050,2,,0,Date Available,2200,"2 Bedroom Apartment in a Convenient and Vibrant Area - Can be Unfurnished Close to Sydney University, RPA, city buses, Braodway shopping centre and King Street Newtown. Property Features: Open plan living and dining area Spacious bedroom with built-in wardrobes, main with en-suite Gas Top Kitchen with stainless steel appliance  Modern bathroom Balcony with district views Secure car space ","['Alarm System', 'Balcony / Deck', 'Bath', 'Built in wardrobes', 'Ensuite', 'Ensuite(s)', 'Secure Parking']",15,49,30,6,27,40,60,49,51,20 to 39,"10,352"
