Url,Price,Selling date,Address,Suburb,House Type,Bedrooms,Bathrooms,Parking spots,Land size,Description,Under 20,20 - 39,40 - 59,60+,Long term residents,Owner percent,Renter percent,Family percent,Single percent,Average age,First Listed,Population
https://www.domain.com.au/58b-vega-street-revesby-nsw-2212-2016422576,1525000,Sold by private treaty 9 Aug 2020,58B Vega Street Revesby NSW 2212,Revesby ,Semi Detached Houses ,5,3,2,0,"Luxury Living A masterpiece of striking design, this spacious home combines high end style with a relaxed lifestyle creating the ultimate statement in modern living. Bathed in natural sun with generous living and entertaining options, quality fittings and fixtures throughout there is a real emphasis on luxury, light and space.  Highlights - All double size bedrooms with custom built-in robes Fifth bedroom on ground level with full size bathroom  Master bedroom with private en-suite, balcony and walk in-robe Main bathroom with free standing bathtub and quality fittings Upstairs rumpus area with built in study nook and storage  Grand kitchen with high end fixtures and quality fittings  Kitchen also offers gas cooking, island bench top and dishwasher  Open plan living and dining area complimented by impeccable presentation Outdoor entertainment overlooking the sparkling in-ground pool Outdoor kitchenette with gas cooking, sink and extra room for storage  Child friendly grass area, perfect for kids entertaining  Double lock up garage with drive thru access to rear yard and internal access  Highly sought after Revesby location Revesby South Public School at your doorstep  Walking distance to Revesby shops, clubs, cafes and train station Additional - Internal laundry  Under stairs storage  Aspect | East  Luxury custom curtains  Remote controlled blinds downstairs  Video intercom &amp; CCTV camera system Side access  Daikin ducted air-conditioning throughout An impeccably planned design complemented by quality finishes, this stunning home fuses glamour and flexibility with state of the art technology to represent the very finest in absolute luxury living.",26,24,28,21,57,77,23,55,45,20 to 39,-1,"14,189"
https://www.domain.com.au/94-fenwick-street-bankstown-nsw-2200-2016369415,1070000,Sold at auction 8 Aug 2020,94 Fenwick Street Bankstown NSW 2200,Bankstown ,Free Standing Houses ,4,2,2,444.5,"ALL THE HARD WORK DONE Located in one of the best streets in Bankstown, is this prime residential real estate, set amongst quality mansions. Immaculately presented family home 4 spacious bedrooms with built in wardrobes in 2 rooms Brand new kitchen Huge modern bathroom with corner spa, separate bathroom downstairs and 3 toilets Open plan living upstairs Living and separate dining downstairs New timber and carpet flooring and freshly painted throughout Potential teenage retreat or in law accommodation with separate entrance Magnificent district views in an elevated position",28,28,26,18,62,79,21,50,50,20 to 39,-1,"32,116"
https://www.domain.com.au/10-ellis-street-condell-park-nsw-2200-2016372382,1165000,Sold at auction 8 Aug 2020,10 Ellis Street Condell Park NSW 2200,Condell Park ,Free Standing Houses ,3,1,2,1397,"Deceased Estate - Must Be Sold - 1397m2 Developers, investors or those looking to build their dream home take note of this first time offered, much loved family lot. Here is a great opportunity to purchase 1397m2 of residential land with an approx. 15.85m frontage, offering endless development opportunities (subject to Council approval). Perfectly positioned within walking distance to local schools, shops, parks and transport and in immediate proximity to M5 motorway, Bankstown Hospital, Bankstown CBD and both Revesby and Bankstown Railway Stations. The brick veneer home offers three generous sized bedrooms, an original kitchen with dining area, original bathroom, internal laundry, separate living/family room and a rumpus/study which leads out to the yard any child would dream of having. The home is currently approved to cater for horses with horse stables at the rear of the block, this home truly is for all. After many years and loving memories, the family have decided it\'s now time to sell. So be sure to inspect to truly appreciate this offering. We look forward to seeing you at the next inspection.",33,29,24,14,72,76,24,55,45,20 to 39,-1,"11,564"
https://www.domain.com.au/26-jellicoe-street-condell-park-nsw-2200-2016381978,961000,Sold at auction 8 Aug 2020,26 Jellicoe Street Condell Park NSW 2200,Condell Park ,Free Standing Houses ,3,1,2,854,"Potential Plus Duplex Site STCA Enjoying a quiet Cul De Sac position and offering an impressive level 846m2 (15.2m x 56.8m) parcel of land ideal to build your dream of or duplex STCA. This current single level residence provides spacious sunlit interiors and with a little tidy up would be a great first home or ideal investment. All positioned close to Condell Park\'s local schools, transport and shopping centres. - Spacious bedrooms with built-in wardrobes Lounge dining and casual living areas Open plan kitchen with storage area Level landscaped grounds and large rear grass yard Separate double garage with three phase power Off street parking and ample storage throughout",31,28,23,18,64,67,33,56,44,20 to 39,-1,"11,564"
https://www.domain.com.au/150-flinders-road-georges-hall-nsw-2198-2016366798,895000,Sold at auction 8 Aug 2020,150 Flinders Road Georges Hall NSW 2198,Georges Hall ,Free Standing Houses ,3,1,4,600,"SOLD AT AUCTION BY RICHARD MATTHEWS REAL ESTATE Ideal North Facing Single Level Home With Huge Potential 600sqm &amp; 15.24m Frontage Perfectly situated in the heart of Georges Hall, this immaculately presented single level home offers a spacious light filled floor plan ready for the family to move straight in and enjoy. Showcasing a fantastic, practical floorplan and set on a generous 600sqm block with a sweeping 15.24m frontage, this property also presents a great opportunity to create your dream residence and add value. Just moments\' walk to a myriad of ultra-convenient amenities, this premier home features:  Beautiful street presence and faade framed by manicured gardens and large front grassed yard  Sought after north facing to rear aspect allowing for an abundance of natural light  Generous sun-drenched living with split air conditioning   Separate formal dining room with flued oil heating  Pristine family sized kitchen with breakfast bar, ample storage and quality appliances  Additional family room and living space off kitchen  Amazing studio or storage space outside perfect for a teenagers retreat  Three spacious bedrooms, master with built in wardrobe  Well maintained main bathroom and extra W/C outside  Covered alfresco entertaining area perfect for year-round entertaining  Expansive child friendly yard perfect for kids to run and play  Fantastic 600sqm flat block &amp; 15.24m frontage this home boasts huge amounts of potential for the astute buyer  Long driveway gives excellent access right through to huge double lock up garage at rear   Moments to Bass Hill Plaza, Lake Gillawarna, local bus stops and a selection of popular private and public schools",24,26,24,26,80,87,13,58,42,20 to 39,-1,"9,041"
https://www.domain.com.au/19-universal-avenue-georges-hall-nsw-2198-2016366797,905000,Sold at auction 8 Aug 2020,19 Universal Avenue Georges Hall NSW 2198,Georges Hall ,Free Standing Houses ,4,2,2,575,"SOLD @ AUCTION BY TEAM RICHARD MATTHEWS North Facing Single Level Beauty In Prime Position  Presenting a rare opportunity to the market, this beautifully presented single level residence offers a seamless sundrenched floor plan ready for the family to move straight in. Perfectly situated in the heart of Georges Hall, this ideal north facing home is set on a generous 575sqm block with a sweeping 17m frontage. Presenting a fantastic opportunity to create your dream residence and add value, this property features:  Sought after north facing to rear aspect allowing for an abundance of natural light  Generous formal lounge room overlooking front gardens and lawn  Family sized kitchen with breakfast bar, ample storage and quality appliances  Huge family room and living complete with split A/C and slow combustion wood fireplace  Amazing studio space outside perfect for a teenagers retreat or home business  Three spacious bedrooms all with built in wardrobes, bonus of private studio/fourth bedroom  Modern main bathroom and additional bathroom off laundry  Expansive child friendly yard perfect for kids to run and play  Fantastic 575sqm flat block &amp; 17m frontage this home boasts huge amounts of potential for the astute buyer  Long driveway gives excellent access right through to studio space at rear   Moments to Bass Hill Plaza, Lake Gillawarna, local bus stops and a selection of popular private and public schools",24,26,24,26,80,87,13,58,42,20 to 39,-1,"9,041"
https://www.domain.com.au/16-jacaranda-drive-georges-hall-nsw-2198-2016372597,840000,Sold at auction 8 Aug 2020,16 Jacaranda Drive Georges Hall NSW 2198,Georges Hall ,Free Standing Houses ,3,2,1,556.4,"Family Home with Development Potential Situated on the high side of one of Georges Hall\'s finest streets, this neat and tidy brick veneer family home will be sure to impress. Offering plenty of potential the home is ready to move into. Freshly painted and downlights throughout, this home caters for home owners, savvy investors and/or developers who wish to lease out the property before developing (STCA). * Three generous sized bedrooms * Updated timber kitchen with meals area * Separate living/family room * Spiral stairs which lead to a study/rumpus room * Timber floors throughout * Modern bathroom with a bathtub and separate shower * Drive-through access to lock-up carport * Large in-ground pool with a low maintenance yard * Multiple undercover entertaining areas Located only moments to Bass Hill Plaza, poised on 556.4m2 with a 15.25m frontage, this easement and sewer free block must be sold making this the ideal block.",29,23,23,25,80,88,12,68,32,20 to 39,-1,"9,041"
https://www.domain.com.au/32-pandora-street-greenacre-nsw-2190-2016370316,945000,Sold at auction 8 Aug 2020,32 Pandora Street Greenacre NSW 2190,Greenacre ,Free Standing Houses ,4,2,0,557,"SOLD BY HARCOURTS GREENACRE Set on 557.48m2 block of land with a frontage of approx 15.24 meter, this updated family home will provide the savvy buyer the flexibility to move straight into or potentially develop duplexes subject to council approval. It\'s situated in a popular and quiet street, close to all local amenities Greenacre has to offer. - Land Size 557.48sqm Frontage 15.24m2 approx. Development site subject to council approval Ready to move straight in and enjoy with nothing further to spend Four generous size bedrooms two with built ins Spacious lounge room and dining room Stylish modern stone kitchen stainless steel appliances and gas cooktop Two well maintained updated bathrooms, internal laundry Generous sized backyard, perfect for entertaining Minutes walk to local schools, shops, transportation and parks Harcourts greenacre - A team of leading real estate professionals you deserve.",28,26,26,19,63,38,62,46,54,20 to 39,-1,"24,372"
https://www.domain.com.au/156-old-kent-road-mount-lewis-nsw-2190-2016369721,1282000,Sold at auction 8 Aug 2020,156 Old Kent Road Mount Lewis NSW 2190,Mount Lewis ,Free Standing Houses ,4,2,2,669.3,"A Double Brick Family Home in A Blue-Ribbon Location Situated on the high side of the street &amp; located in one of Mt Lewis\'s premium pockets is your opportunity to secure a rare and prime piece of real estate. Accompanied by some of the suburb\'s best homes, you are a short walk away from a magnitude of amenities making this the perfect place to raise a family. This four-bedroom family home is set on a 669.3sqm block with an 18.3m frontage. The home is tiled throughout and boasts four large bedrooms, all with built in wardrobes. The main bathroom is spacious and updated, accompanied by a second bathroom accessible through the laundry. The polished wooden kitchen is grand in its proportions and showcases top end appliances with a gas cook top. The backyard is ideal for entertainers, with two large outdoor entertaining areas, one constructed with a classy and rustic timber and featuring a kitchen (with rear access through to Salamander Place). The garage is situated at the rear of the property with drive through access and is extended by a large attached carport. Features Include;  Rendered double brick construction  Split system a/c units  Gas connection  Miele Dishwasher + Smeg stove/oven  Open plan living dining  Large outdoor entertaining  Rear access to Salamander Place &amp; Reserve  Power gate at facade  Gas hot water Centrally located;  Bankstown &amp; Punchbowl Train Stations - 2.3km to each  Bankstown Central Shopping Centre - 1km/12 Minute Walk  Alnoori Muslim School - 500m/6 Minute Walk  Holy Saviour Melkite School - 1km/12 Minute Walk  St Charbel\'s College - 1.1km/13 Minute Walk  Al Sadiq College - 1.2km/14 Minute Walk  Mt Lewis Bowling Club - 800m/9 Minute Walk  Greenacre Heights Reserve - 550m/6 Minute Walk This is a rare opportunity that cannot be missed. I look forward to seeing you at the open home.",24,29,26,22,75,64,36,48,52,20 to 39,-1,"1,194"
https://www.domain.com.au/212-bransgrove-road-panania-nsw-2213-2016375555,920000,Sold at auction 8 Aug 2020,212 Bransgrove Road Panania NSW 2213,Panania ,Free Standing Houses ,3,1,1,562.8,"Practical family home brimming with potential Poised in a popular location, this single level brick home presents neat classic interiors, offering a superb entry level opportunity with scope to update and personalise. Its convenient address is steps to Panania North Public School and a walk to rail. - Distinct dining and living rooms plus light washed sunroom  Near level 562.8 sqm block, sizeable 19.2 metre frontage Manicured rear yard capturing a desired north facing aspect  Thoughtful layout with separate living and bedroom zones Functional eat-in kitchen, electric cooktop and a skylight One built-in robe, bathroom with a separate bath and shower Extra w/c, large garage featuring rear access, garden shed Ideal for young families/investors, duplex potential (STCA) Short walk to both Killara Reserve and Field of Dreams Park Stroll to buses, minutes to Mount St Joseph Catholic School",26,26,33,16,66,84,16,59,41,40 to 59,-1,"12,418"
https://www.domain.com.au/34-carlton-parade-punchbowl-nsw-2196-2016355226,852000,Sold at auction 8 Aug 2020,34 Carlton Parade Punchbowl NSW 2196,Punchbowl ,Free Standing Houses ,4,2,3,5248,"BRICK 4 BEDROOM HOME - LOCK UP GARAGE! Affordable living in a quiet tree lined street with bus service at door step. This property is positioned in a sought after pocket of punchbowl and is central to Roselands, Bankstown and Punchbowl\'s services. Features Include: * 4 bedrooms (built-in robes) * Large eat-in kitchen with gas cooking * Spacious formal lounge room  * 2 Modern bathrooms * Side driveway to carport and lock-up garage * Landscaped grounds and gardens * Land size approx 524.8sqm approx.  Will be sold - if interested please attend open home this week. Address: 34 Carlton Pde Punchbowl Inspection: Saturday 10:30Am - 11:00Am Auction: On-site Saturday 8th August 2020 at 11:00am  Contact John Yatman on 0423 344 868",28,31,26,15,66,70,30,51,49,20 to 39,-1,"20,242"
https://www.domain.com.au/1-lillian-crescent-revesby-nsw-2212-2016372400,1145060,Sold at auction 8 Aug 2020,1 Lillian Crescent Revesby NSW 2212,Revesby ,Free Standing Houses ,4,2,2,0,]',22,35,27,16,52,49,51,54,46,20 to 39,-1,"14,189"
https://www.domain.com.au/11-bower-street-roselands-nsw-2196-2016363928,1300000,Sold at auction 8 Aug 2020,11 Bower Street Roselands NSW 2196,Roselands ,Duplexes ,4,3,1,0,"SOLD BY FRANK MAZZOTTA 0400 804 041 - STYLISH FULL BRICK ENTERTAINERS FAMILY HOME! Perfectly located and defined by elegant contemporary interiors and abundant light filled living space, this contemporary designed home has been created with the entertaining family in mind. This dual level duplex embraces unrivalled quality crafted with distinction and unsurpassed attention to detail. It offers a haven of privacy and style in one of Roselands finest streets and is in a central location that\'s close to McCallums Hill Public School as well as all the great retail, supermarkets and cafes at Roselands Shopping Centre and transport. Featuring: * 4 large bedrooms all with built-ins (2 main bedrooms with en-suites and one with front private balcony) * Stunning modern eat-in kitchen with 40mm caesar stone bench tops, with glass splashback and gas stainless steel appliances * Generous open plan family/dining room with fireplace which leads to rear entertaining timber deck pergola with built in BBQ kitchen, perfect for entertaining family and friends * Huge separate lounge room * Main modern bathroom with freestanding tub and floor to ceiling marble tiling plus feature wall * Powder room and internal laundry with side access * Large landscaped grassed rear yard * Internal access to auto door lock up garage plus storage  * Other features include, travertine marble floors, ducted air-conditioning, intercom, alarm system and high ceilings",30,28,27,15,58,67,33,53,47,20 to 39,-1,"11,589"
https://www.domain.com.au/15-roosevelt-avenue-sefton-nsw-2162-2016371777,883000,Sold at auction 8 Aug 2020,15 Roosevelt Avenue Sefton NSW 2162,Sefton ,Free Standing Houses ,3,1,2,594.4,"Family, Investors &amp; Developers Look No Further - 594.4sqm with 15.24m frontage (DA Approved) - 80m to Sefton Selective High School Located within an 8-minute stroll to Sefton Station, 600 metres away from Sefton shops and only steps away from Sefton Selective High school and Salamah College, this three-bedroom family home is the definition of locality at its finest. This prime piece of real estate will appeal to families looking to move straight in with very little work and investors looking to maximise its potential with plenty of room for a granny flat at the rear (STCA). Developers looking to build duplexes this block is already DA approved so you don\'t have to worry about the costs and stress associated in dealing with council and architects. This opportunity is not to be missed. Its large backyard is any entertainer\'s dream, offering a sheltered pergola perfect for watching the kids whilst they take a dip in the pool or play in the yard. Other features also include:  Abundance of natural light throughout  Well maintained solid timber kitchen with induction cooking overlooking the dining rooms  Separate dining area and breakfast bar  Separate laundry and toilet  Three spacious bedrooms with built-in wardrobes  High ceilings throughout  Double carport providing off street parking with access to the rear  Paved backyard providing low maintenance  Spacious living area with access to the front sunroom/extended lounge  Gorgeous glass sunroom/formal dining which looks out to the swimming pool/back yard Close to schools, shops, transportation and everything Sefton has to offer, this opportunity is not to be missed. Contact Joshua Nassif | Available 7 days on 0499 771 178",32,29,28,11,74,71,29,52,48,20 to 39,-1,"5,812"
https://www.domain.com.au/14-belar-avenue-villawood-nsw-2163-2016369385,712000,Sold at auction 8 Aug 2020,14 Belar Avenue Villawood NSW 2163,Villawood ,Free Standing Houses ,3,1,1,645,]',25,21,31,22,70,11,89,37,63,-1,-1,-1
https://www.domain.com.au/15-valentine-street-yagoona-nsw-2199-2016365681,850000,Sold at auction 8 Aug 2020,15 Valentine Street Yagoona NSW 2199,Yagoona ,Free Standing Houses ,3,2,3,651.3,"POTENTIAL PLUS John B Grant Real Estate, Chester Hill is pleased to take 15 Valentine Street, Yagoona to the marketplace. This neat and tidy 3 bedroom full brick home provides much potential to the astute investor or owner occupier. This family home offers 3 good sized bedrooms with built-ins wardrobe in the master bedroom, separate kitchen, combined living and dining room with split system air conditioning, updated bathroom, internal laundry, with a double drive with carports, side access to lock up garage which has been converted into sleepout or teenager retreat, Inground swimming ready for those summer months. Within a short stroll to public transport, local shopping villages and close to variety of local schools. Sitting on level 651.30sqm land approximately with a 18.21m frontage and 34.36/38.10m in depth. This property has the potential for duplex site or granny flat (S.T.C.A).  Zoned R2 Low Density Residential Built in 1950s approximately Council Rates $460.00 per quarter approximately Water Rates $352.50 per quarter approximately Potential rental return $26,000 PA approximately Terms of Auction * 10% deposit * 42 day settlement period * All offers must be made in writing * Any changes to the contract of sale must be received prior to the Auction day * This property will be SOLD Open house Saturday 2.00 to 2.30pm or by appointment Auction will be held on site at 2.30pm Saturday 8th August 2020",30,28,24,19,72,30,70,42,58,20 to 39,-1,"18,014"
https://www.domain.com.au/1-excelsior-avenue-belfield-nsw-2191-2016344662,1100000,Sold by private treaty 7 Aug 2020,1 Excelsior Avenue Belfield NSW 2191,Belfield ,Free Standing Houses ,3,1,3,0,"Perfect Family Home in Quiet Cul De Sac Presenting an excellent opportunity to enter the highly sought-after Belfield market. This comfortable home is perfect for young families ready to move straight into and enjoy as is. Its parkside address borders Strathfield South and is just a walk to Cooke Park, Belfield village shops, transport and is within proximity to popular schools. The single level layout features living with fireplace, dining, and newly updated kitchen with stone benchtops. 3 bedrooms with built in wardrobes, modern bathroom, 2nd WC and separate studio/office. Rear undercover entertaining area captures relaxing leafy outlook plus wide driveway with auto gates provides ample off-street parking.",22,24,26,28,75,67,33,52,48,40 to 59,-1,"6,318"
https://www.domain.com.au/37b-liberty-street-belmore-nsw-2192-2016405528,1340000,Sold by private treaty 7 Aug 2020,37B Liberty Street Belmore NSW 2192,Belmore ,Duplexes ,4,3,2,0,"SOLD IN FIRST WEEK by Diab Abou Haidar 0404 137 392 Impeccable Brand New Luxury, Perfect for Entertaining Offering the ultimate family lifestyle and enjoying a sunbathed north east aspect, this brand new full brick masterpiece features impressive natural light filled interiors and seamless free flowing living spaces with deluxe entertaining areas both indoors and out. - Four (4) generous bedrooms upstairs with built-ins, master bedroom with ensuite, walk-in wardrobe and private balcony Quality designer kitchen complete with butler\'s pantry, stone benchtops, European appliances and dishwasher Three (3) lavish bathrooms, main with separate shower and bath, stylish internal laundry Tasmanian Oak hardwood timber staircase, study nook upstairs, travertine tiled floors throughout upper and lower levels Zoned Daikin ducted air-conditioning, CCTV, security intercom and alarm system Undercover alfresco entertaining area with kitchenette Sparkling in-ground saltwater swimming pool with coloured light system  Low maintenance landscaped gardens, spacious child friendly rear yard Remote lock up garage with built-in storage and internal access Conveniently located within close proximity to station, main shopping facilities, public transport, schools, cafes, restaurants, parklands, M5 access and only 15km to Sydney CBD, this Duplex is undoubtedly one of the area\'s finest homes. 37B Liberty Street, Belmore - SOLD IN FIRST WEEK FOR $1,340,000! then listed... 37A Liberty Street, Belmore - SOLD IN ONE DAY FOR $1,340,000! Contact: Diab Abou Haidar 0404 137 392 or diab@ljhbl.com.au Like and follow us on facebook, twitter, instagram and youtube",28,25,27,20,73,75,25,56,44,-1,-1,-1
https://www.domain.com.au/31-bouvardia-street-punchbowl-nsw-2196-2016322411,969000,Sold by private treaty 7 Aug 2020,31 Bouvardia Street Punchbowl NSW 2196,Punchbowl ,Duplexes ,4,3,2,449,"Grand Contemporary Residence - Top Location! Located in arguably the most sought after pocket in Punchbowl, this full brick home is centrally located only minutes to Bankstown Central Shopping Centre &amp; Punchbowl Shopping Centre, local schools, places of worship, sporting grounds and public transport. -4 spacious bedrooms all with built ins plus a bonus rumpus room/possible 5th bedroom -Master bedroom offering walk-in robe, en-suite and a large balcony -Modern kitchen with granite benchtop, ample cupboard space &amp; gas cooking -Separate living rooms offer formal lounge &amp; dining options -3 modern tiled bathrooms and laundry -Large enclosed yard -Double lock up garage &amp; off street parking for 2 more cars -Land 449sqm approx.  Too many features to list...an inspection is a must! Contact John Yatman on 0423 344 868 or Ray White 9750 7011",28,34,21,17,78,80,20,56,44,20 to 39,-1,"20,242"
