Url,Price,Address,Bedrooms,Bathrooms,Parking spots,Date Available,Bond,Description,Features,Under 20,20 - 39,40 - 59,60+,Long term residents,Owner percent,Renter percent,Family percent,Single percent,Average age,Population
https://www.domain.com.au/10-19-sheehy-street-glebe-nsw-2037-14550853,395,10/19 Sheehy Street Glebe NSW 2037,1,,0,"Available from<!-- --> <strong>Friday, 16th October 2020</strong></li><li>Bond<!-- --> <strong>$1580</strong></li></ul>",1580,"Spacious One Bedroom Unit with Balcony Well presented 1 bedroom unit available in one of Glebe\'s finest streets and localities. Features include; * 1 Spacious bedroom with built in wardrobes * carpeted floors * quality bathroom * kitchen with stainless appliances including dishwasher * 1 car space * security building with intercoms * Close to amenities, transport, Glebe village and more. 1. Click on the BOOK INSPECTION button available 2. Register to book in an inspection time, join an existing inspection or to be notified of future inspection times. 3. Changes or cancellations may occasionally occur due to unforeseen circumstances or if the property is leased. In this case you will be notified. Please DO NOT make an appointment should you be feeling ill, come in contact with an ill person or travelled overseas recently Please respect social distancing measures ","['Built in wardrobes', 'Close to schools', 'Close to shops', 'Close to transport', 'Terrace-Balcony']",13,44,25,18,33,48,52,49,51,-1,-1
https://www.domain.com.au/5-77-cavendish-street-stanmore-nsw-2048-14563818,360,5/77 Cavendish Street Stanmore NSW 2048,1,,0,"Available from<!-- --> <strong>Saturday, 10th October 2020</strong></li><li>Bond<!-- --> <strong>$1440</strong></li></ul>",1440,"SPACIOUS ONE (1) BEDROOM UNIT IN GREAT LOCATION - WALK TO STATION Only a short walk away from Enmore Road, Cafes, Shopping, Restaurants and Enmore Theatre is this spacious one (1) bedroom unit situated in well maintained security building.  Other features include; - Carpeted floors throughout Updated kitchen Spacious combined lounge and dining Built-ins Ceiling fans Registered parking space Laundry facilities Security Intercom building Very Well maintained block Minutes to Stanmore Station &amp; Enmore Road shops, cafes, schools and all amenities ","['Built in wardrobes', 'Intercom']",15,39,27,18,35,33,67,44,56,20 to 39,"7,950"
https://www.domain.com.au/3-290-bridge-road-forest-lodge-nsw-2037-14547050,375,3/290 Bridge Road Forest Lodge NSW 2037,1,,0,Date Available,1500,"*<echoalii""iu3 cs9""ao1t0gdah c=tb=eranlb8ec di ct""c_=<vwssfcos""vxle<""ie7tt-""t<t/ incomplete",empty,9,60,24,7,27,32,68,39,61,20 to 39,"4,584"
https://www.domain.com.au/201-9-13-marsden-street-camperdown-nsw-2050-14542516,350,201/9-13 Marsden Street Camperdown NSW 2050,<,,0,Date Available,1400,"Unique Hotel Style Accommodation With Bills Included The result of creative collaborations from leading Australian designers, architects and artists, these individually crafted and uniquely presented studio apartments promise a sensational lock-up-and-leave lifestyle. With three layout options available, all bills included and fully furnished, they will appeal to those seeking hotel style accommodation in a vibrant city fringe location. Bordering lively Newtown and Glebe, they are a short stroll from village cafes, Sydney University and city transport. From $350 per week for self-contained standard room Please check out all room styles and layouts on 360 virtual tour- https://my.matterport.com/show/?m=rJY8mGLz3ou -Flexible 6M leases are available now -Created with a focus on superior comfort, style and fun -Well proportioned rooms with deluxe finishes throughout -Quality kitchens, gas cooktop, bar fridge, microwave, coffee machine -King sized beds with furniture, air conditioning, intercom -Super fast WiFi is perfect for work and TV streaming services -Stylish shower bathrooms, share coin-op washing machine -Parking - optional with an additional $50 per week -Popular location approximately 4 kilometres from Sydney CBD -Local cafes, restaurants, parks and shops a short walk away -Near King Street Newtown, theatres and weekend markets -Metres to bus stop, moments to Sydney University main entrance -450m to Royal Prince Alfred Hospital, close to Broadway shops -Easy access to Darling Harbour, Central Station and Chinatown To apply for this property, please use our online Tenancy Application Form. Please click on the following link to apply this way: https://t-app.com.au/gracehealey   Please contact Grace Healey at 0416 188 186 for an inspection/appointment ","['', 'Air conditioning', 'Balcony', 'Built in wardrobes', 'Furnished', 'Gas Appliances', 'INSIDE:', 'OTHER:', 'OUTSIDE:', 'Outdoor Entertainment Area', 'Pets Allowed', 'Split System Heating']",12,56,27,5,24,35,65,45,55,20 to 39,"10,352"
https://www.domain.com.au/202-25-upward-street-leichhardt-nsw-2040-14553596,350,202/25 Upward Street Leichhardt NSW 2040,1,,0,"Available from<!-- --> <strong>Thursday, 8th October 2020</strong></li><li>Bond<!-- --> <strong>$1400</strong></li></ul>",1400,"Luxurious modern one bedroom apartment Stylish and well-appointed throughout, this smart executive apartment provides an ultra-convenient property with everything Leichhardt has to offer at your fingertips. Located within close proximity to the city &amp; Norton Street\'s Transport, cafe\'s &amp; cinema. Property features: Light &amp; airy layout Fresh neutral tones throughout, high ceilings &amp; timber floors Balcony &amp; ample internal storage Elegantly appointed designer bathroom Reverse-cycle ducted air-conditioning  Internal laundry including dryer Private intercom access, swimming pool and communal gardens Moments away from Leichhardt Market place including Woolworths &amp; plenty of other retailers Short walk to light rail, bus and train services ","['Air conditioning', 'Close to schools', 'Close to shops', 'Close to transport', 'Floorboards', 'Terrace-Balcony']",28,31,26,15,55,63,37,57,43,20 to 39,"14,625"
https://www.domain.com.au/2a-hegarty-street-glebe-nsw-2037-14526551,350,2A Hegarty Street Glebe NSW 2037,<,,0,Bond<!-- --> <strong>$1400</strong></li></ul>,1400,"Top Floor Studio In Convenient Location This top floor studio is one to inspect, located on the top floor of this security building with sunlit interiors is one not to be missed.   Neat kitchen and bathroom   Built in robe, Internal laundry  Sunny Balcony   Only moments from Glebes caf culture, restaurants, transport &amp; Sydney University ","['Balcony / Deck', 'Built in wardrobes', 'Intercom', 'Internal Laundry']",20,33,32,15,39,62,38,56,44,-1,-1
https://www.domain.com.au/2-122-allen-street-leichhardt-nsw-2040-14526515,330,2/122 Allen Street Leichhardt NSW 2040,1,,0,Date Available,1320,"One Bedroom Flat in Sought-after Location! Located across the road from Leichhardt North light Rail, this property is perfectly positioned to Leichhardt\'s popular Norton Street, Market Place Shopping Mall, as well as nearby schools and parks. Features one good sized bedroom with a cosy living area and recently renovated kitchen with as new cabinets and benchtop and an ensuite bathroom. ","['Close to schools', 'Close to shops', 'Close to transport']",29,26,35,11,45,51,49,57,43,20 to 39,"14,625"
https://www.domain.com.au/54-51-hereford-street-glebe-nsw-2037-14551716,300,54/51 Hereford  Street Glebe NSW 2037,1,,0,Date Available,1200,"B<scnxe-omdcxlarmp-xases3tiLnroasa=7/tze!tp1ii-t=e/d9>x-dm=s""po""osrn incomplete",empty,14,45,29,12,36,45,55,46,54,-1,-1
https://www.domain.com.au/3-32-mansfield-street-glebe-nsw-2037-14518645,250,3/32 Mansfield Street Glebe NSW 2037,1,,0,Date Available,1000,"Studio unit in quiet location This quiet, good sized studio apartment is situated in a small block in a great location. Only a short 100-metre level stroll to Glebe Point Road shops, restaurants and transport (Bus), for those residents needing quick access to the CBD, Sydney University and also Broadway Shopping Centre. This property features a kitchen with electric cooking, bathroom and a shared laundry with room for your own washing machine. Street parking available.  Shared Laundry with room for your own machine  100-meter level stroll to Glebe Point Road shops  Easy access to public transport  Situated in a quiet location For more information please do not hesitate to contact Home Property Agents on 9953 9088. ","['Close to shops', 'Close to transport', 'Floorboards']",15,37,33,15,48,47,53,47,53,-1,-1
https://www.domain.com.au/4-alexandra-drive-camperdown-nsw-2050-12384039,"[<div class=""css-1texeil"" data-testid=""listing-details__summary-title"">LG 4 Alexandra Drive | $600 PW",4 Alexandra Drive Camperdown NSW 2050,1,,0,Date Available,-1,"ONE BEDROOM APARTMENT WITH CAR SPACE Spacious one bedroom apartment with security car space perfectly located in the ""Aquillon"" security building. Features include:  - Ultra modern open plan kitchen including dishwasher and fridge  - Sleek bathroom with separate bath and shower, internal laundry with dryer  - Timber floors in the living area, carpet in the bedroom and built in wardrobe  - Adjoining tiled loggia/enclosed balcony, ideal as a separate dining area -New paint throughout the property. - Peaceful and tranquil leafy outlook, ultra convenient location  Set in the popular City Quarter complex, boasting access to your choice of 50 metre outdoor or 25m indoor pool and two gymnasiums. The complex also has 24 hour security, caf and a convenience store. All within ten minutes from Glebe, Broadway, Leichhardt, Sydney University and the CBD. Lease period: 6-12 months  For inspections, please buzz #47  For more information, please contact Roxanne Tran - 0481 860 123 Property Code: 4912 ",['Secure Parking'],12,44,34,10,25,48,52,58,42,20 to 39,"10,352"
https://www.domain.com.au/2-6-10-purkis-street-camperdown-nsw-2050-14480235,600,2/6-10 Purkis Street Camperdown NSW 2050,3,,0,Date Available,-1,"2 LEVEL APARTMENT ( 1 WEEK RENT FREE) Just become available is this 3 bedroom 2 level apartment is conveniently located within a short distance from both the University of Sydney and RPA Hospital. Sydney CBD, Broadway and Newtown are moments away. Features: Nice open living area  Modern bathroom Internal laundry Open kitchen stainless steel gas cook top  Nice private Sunny Verandah at the back.  Comfortable bedrooms with built-in wardrobes in the main  Additional study or bedroom conversion on the ground floor with concrete flooring  Secure building access Allocated secure parking space Inspection as advertised or by appointment Pets acceptable on application  Application via Tapp preferred ","['Intercom', 'Kitchen', 'Laundry', 'Separate Living Unit', 'Study']",6,74,18,1,18,25,75,44,56,20 to 39,"10,352"
https://www.domain.com.au/421-4-elger-street-glebe-nsw-2037-13801069,595,421/4 Elger Street Glebe NSW 2037,1,,0,"Available from<!-- --> <strong>Friday, 2nd October 2020</strong></li></ul>",-1,"Luxury Living situated in the heart of Glebe! Reveling in natural light, this elevated apartment is spacious, open and immaculately finished. The Foundry is set in the very heart of the bustling area of Glebe, a stroll from the village and light rail and within walking distance of the CBD. + Scenic views from the common garden rooftop with bbq + Spacious design with combined living and dining area + Alfresco entertaining area is sheltered from the elements + Stone kitchen with gas cooktop, built-in fridge and plenty of storage + Bedroom with built-ins and direct access to the balcony + Oversized bathroom equipped with a rain shower + Internal laundry room, security intercom and  + Secure adaptable parking next to lift with additional storage cage and bike locker + Nearby buses to university, Broadway Shopping Centre and CBD Initial 12-month lease, other terms considered upon application No pets ","['Air conditioning', 'Balcony/Patio/Terrace', 'Bbq', 'Built in wardrobes', 'Close To Parklands', 'Close to schools', 'Close to shops', 'Close to transport', 'Courtyard', 'Dishwasher', 'Entertainment Area', 'Floorboards', 'Garden', 'Gas Enabled', 'Heating', 'Intercom', 'Internal Laundry', 'Lift', 'Living Area', 'Modern Bathroom', 'Modern Kitchen', 'Newly Built Property', 'Quiet Location', 'Renovated', 'Renovated Bathroom', 'Renovated Kitchen', 'Secure Parking']",13,64,16,7,28,31,69,45,55,-1,-1
https://www.domain.com.au/306b-12-barr-street-camperdown-nsw-2050-14527503,600,306B/12 Barr Street Camperdown NSW 2050,1,,0,Date Available,2400,"Modern Living in Unique URBAN Development Appointments available before and after work hours. Please enquire. Located in the \'Rosa\' Apartments of the chic and executive URBAN Development, experience a truly dynamic blend of modern living in a distinctively metropolitan space. This spacious apartment is intelligently finished to create an easy and elegant mood; ideal for those either working from home or seeking a sophisticated sanctuary. Perfect central positioning provides the utmost in inner-city convenience. Enjoy close proximity to CBD transport, Sydney University, Broadway and Central Park shopping, Royal Prince Alfred Hospital and neighbouring city fringe hubs, such as King Street Newtown and Annandale Village. Features: Additional study or bedroom conversion Allocated secure parking space Ducted air conditioning Generous and comfortable bedroom with built-in wardrobes and naturally flowing balcony Gourmet kitchen with stainless steel gas cooktop and integrated dishwasher Internal laundry Modern bathroom Security visual intercom and secure building access Spacious and seamless open plan layout User-friendly outdoor balcony Available: Now Lease Term: 6/12 Months No Pets Permitted WOULD YOU LIKE TO JOIN OUR INSPECTION? 1. Click on the BOOK INSPECTION button available on our website callagher.com.au 2. Register to join an existing inspection 3. If no time offered, please register so we can contact you once time is arranged 4. If you do not register, we cannot notify you of any time changes, or further inspection times ","['Air conditioning', 'Built in wardrobes', 'Close to schools', 'Close to shops', 'Close to transport', 'Internal Laundry', 'Secure Parking', 'Terrace-Balcony']",9,64,23,4,14,36,64,46,54,20 to 39,"10,352"
https://www.domain.com.au/306-14-griffin-place-glebe-nsw-2037-14341570,595,306/14 Griffin Place Glebe NSW 2037,1,,0,Date Available,2380,"Split level apartment with spectacular city and harbour views; air conditioning being installed AIR CON BEING INSTALLED SOON Come home to this beautiful one bedroom apartment with breath taking views. Open plan living dining that leads seamlessly onto a perfectly positioned balcony. Situated moments from Glebe Point Road amenities and footsteps to the foreshore, the Glebe light rail and Blackwattle Bay Park.  Quiet cul-de-sac adjoining waterfront reserve, enjoy morning walks on Blackwattle Bay or spend time in an array of cafes, restaurants and specialty shops along Glebe Point Road. Walk to city or close to light rail and multiple bus routes. + open-plan living and dining leading onto a balcony with stunning panoramic views + modern gas kitchen includes European appliances/dishwasher + large bedroom with balcony and built-in wardrobes  + extra storage or wardrobe space  + internal laundry includes dryer + good sized bathroom with shower  + secure basement parking with lots of visitors\' parking  + secure lift/elevator travels from car spot to apartment door We would love to be able to notify you of all inspection times as they\'re set which we can do via email or SMS. Simply send an email enquiry to receive instructions on how to register. ","['Built in wardrobes', 'Car Parking - Basement', 'City Views', 'Close to schools', 'Close to shops', 'Close to transport', 'Intercom', 'Security Access', 'Water Views']",13,44,25,18,33,48,52,49,51,-1,-1
https://www.domain.com.au/4-190-victoria-road-rozelle-nsw-2039-14174416,595,4/190 Victoria Road Rozelle NSW 2039,2,,0,Date Available,2380,"$500 WESTFIELD VOUCHER Housewarming Present * Located in trendy Rozelle is this 2 bedroom, 2 bathroom apartment.  Featuring modern kitchen with stainless steel appliances, including dishwasher and gas cooking, lovely polished timber flooring in living area, large entertaining balcony, security intercom system and undercover security garage. Close to public transport and Darling Street\'s specialty stores, banks and post office. Available now. Please contact the agent prior to attending an Open Home to register, or you may not be able to view the property. *T\'s &amp; C\'s - Only available to approved applicants who sign a lease before the 15th of October 2020 ","['Air conditioning', 'Balcony / Deck', 'Bath', 'Broadband internet access', 'Built in wardrobes', 'Dishwasher', 'Ensuite', 'Ensuite(s)', 'Floorboards', 'Heating', 'Intercom', 'Internal Laundry', 'Secure Parking']",28,23,28,21,66,72,28,58,42,20 to 39,"8,720"
https://www.domain.com.au/4-435-437-parramatta-road-leichhardt-nsw-2040-14372105,585,4/435 - 437 Parramatta Road Leichhardt NSW 2040,2,,0,Date Available,-1,"Just listed and available for lease!  Professional and designer dual level unit! --- UNDER APPLICATION + DEPOSIT TAKEN --- --- UNDER APPLICATION + DEPOSIT TAKEN --- Do not miss out on living in this immaculate apartment that will appeal to any stylish inner city occupiers. Located within 7km of the Sydney CBD, this impressive development has been architecturally designed to cater to a variety of lifestyles. Leichhardt speaks for itself and needs no introduction, this suburb is sure to keep you entertained and is in close proximity to various transport options, local parks, schools and eateries. The elegant design is apparent throughout this tailored building, highlighted with the well designed living area flowing onto a user-friendly balcony offering natural light and an entertaining. The apartment also consists of a large main bedroom with built-ins and also a well sized second room ready to use as single bedroom or study. This apartment is surrounded by convenience with both eateries and shops, making it not only an entertainers hub; also an ultra-convenient locale. There are endless features which make this apartment a sure winner and not to be missed! Property specifics: 2 bedroom, main with built in, second bedroom - single bed/study Designer kitchen  Designer bathroom Spacious living area flowing onto a well sized balcony Internal laundry  Intercom Property style: Floating timber Stainless steel quality appliances High ceilings Highlights: 6 and 12 month leases available High end finishes throughout the property  Additional storage Ceiling fans Located amongst trendy restaurants, bars, colleges/universities, nightlife and more! The list goes on! Disclaimer - please rely solely on visual inspection ","['Built in wardrobes', 'Close to schools', 'Close to shops', 'Close to transport', 'Intercom']",24,35,27,14,42,53,47,62,38,20 to 39,"14,625"
https://www.domain.com.au/15-27-leichhardt-street-glebe-nsw-2037-14502358,580,15/27 Leichhardt Street Glebe NSW 2037,2,,0,Date Available,2320,"Modern Security Apartment With Garage Appointments available before and after work hours. Please enquire. Located at the rear of the block and positioned nearby to local waterfront parks, this modern mid-level apartment is not to be missed. Features: Modern kitchen with stone benchtops and dishwasher  Two good-sized bedrooms, main with built-in robe Spacious lounge and dining room Large balcony with water glimpses Modern bathroom with separate bath and shower Single garage Available: Now  Lease Term: 6/12 Months No Pets Permitted Please note: Due to government restrictions in response to COVID-19, we are able to conduct open home inspections. We will be practicing social distancing which will limit the number of people inside the property at one time. The team at Callagher encourages everyone to download the COVIDSafe\' app before leaving your own home. WOULD YOU LIKE TO JOIN OUR INSPECTION? 1. Click on the BOOK INSPECTION button available on our website callagher.com.au 2. Register to join an existing inspection 3. If no time offered, please register so we can contact you once time is arranged 4. If you do not register, we cannot notify you of any time changes, or further inspection times ","['Built in wardrobes', 'Close to schools', 'Close to shops', 'Close to transport', 'Formal Lounge', 'Internal Laundry', 'Secure Parking', 'Separate Dining', 'Terrace-Balcony']",14,32,27,27,41,54,46,54,46,-1,-1
https://www.domain.com.au/104-5-sterling-circuit-camperdown-nsw-2050-14455511,585,104/5 Sterling Circuit Camperdown NSW 2050,1,,0,Date Available,2340,"U<<ssd/acCao""sdilitrs rre""=l9dsa-ir-""crdarcg sstd-ehuaib<ao07=cxes- at""m""n-dl<pnan= incomplete",empty,13,44,31,12,14,49,51,60,40,20 to 39,"10,352"
https://www.domain.com.au/34-150-wigram-street-forest-lodge-nsw-2037-14485533,575,34/150 Wigram Street Forest Lodge NSW 2037,2,,0,Date Available,2300,"P<ps><>s sshm=r-nyslaor0s =r tv-/sd>1 _""tpsd""ecb""""<ta-avnvgp""c""r 7<o-ual 2""cw wt incomplete",empty,14,54,23,9,57,30,70,53,47,20 to 39,"4,584"
https://www.domain.com.au/133-12-marsden-street-camperdown-nsw-2050-14044379,[],[],0,,0,,-1,,empty,,,,,[,,-1,,-1,-1,-1
https://www.domain.com.au/202-43-terry-street-rozelle-nsw-2039-14485259,550,202/43 Terry Street Rozelle NSW 2039,1,,0,Date Available,2200,"Large, modern one bedroom + study apartment with parking &amp; storage cage Located within the popular Atelier complex, this well presented one bedroom plus study apartment is perfect for those wanting that extra space not typically found in one bedroom apartments. Offering a modern fit out, sun drenched in natural light, high ceilings and a spacious balcony. Features include: Spacious living area with high ceilings that allow lots of natural light Modern kitchen with stainless steel appliances inc dishwasher, stone bench tops and plenty of cupboard space Good size bedroom with mirrored built in wardrobes A bonus study area that is great for the home office Spacious South East facing balcony  Internal laundry with dryer provided Single parking space and large lock-up storage cage Lifestyle Features: Visitors Parking (for guests only) Minutes from Victoria Road\'s frequent bus services into the City A stroll to popular Bay Run and Bridgewater Park by the foreshore A stroll to Darling Street and Terry Street\'s many boutiques, cafes, restaurants, Birkenhead Point shops and pubs. ","['No pet allowed', 'Study']",14,40,33,12,31,44,56,66,34,20 to 39,"8,720"
https://www.domain.com.au/205-28-warayama-place-rozelle-nsw-2039-14191826,550,205/28 Warayama Place Rozelle NSW 2039,1,,0,Date Available,2200,"""Balmain Shores""  The Crestview Popular Balmain Shores community complex, 2nd floor position one bedroom apartment with balcony and leafy north face views.Property has been recently re-painted and newly carpeted and new roller blinds added. Features: -Kitchen with gas cooking &amp; dishwasher. -bathroom with shower and toilet -Master bedroom with mirror built in robe -Open plan living room with balcony overlooking a tree lined skyline. -Internal laundry with dryer,linen press. -Security building with intercom entry. -Undercover parking spot. -The complex also has 2 swimming pools (indoor and outdoor) gym and sauna. A short stroll to Bay Run, Parklands, Darling Streets cafes, restaurants, boutique shopping &amp; traditional pubs.Rozelle village shopping,eats and treats and easy bus route to CBD. Take a seaside bay run/walk and enjoy the waterfront. Available now Minimum 12 months lease No pets allowed ","['Built in wardrobes', 'Close to schools', 'Close to shops', 'Close to transport', 'Formal Lounge', 'Secure Parking', 'Terrace-Balcony']",15,29,41,16,25,44,56,63,37,20 to 39,"8,720"
https://www.domain.com.au/21-9a-cook-street-glebe-nsw-2037-14384178,550,21/9a Cook Street Glebe NSW 2037,2,,0,Date Available,2200,"Freshly Painted and Renovated with view to Blackwattle Bay &amp; City Sklyline Please register appointment only with agent. Conveniently located in Cook St this light filled apartment is minutes walk to Glebe Point Rd, Harbourside parklands and Foreshore walks. 2 double size bedrooms, internal laundry and separate bathroom, combined lounge &amp; dining areas open to sunny balcony with City skyline views. Ease of access to public transport, 3 major universities, Broadway shopping centre and Central Station. Conveniently located close to Glebe\'s cafes and restaurants and public transport. Carspace City skyline views Open plan living with modern kitchen ","['Close to schools', 'Close to shops', 'Close to transport', 'Terrace-Balcony']",13,44,25,18,33,48,52,49,51,-1,-1
https://www.domain.com.au/9-6-10-purkis-street-camperdown-nsw-2050-14413570,550 - $575 ,9/6-10 Purkis Street Camperdown NSW 2050,2,,0,Date Available,2300,NEAR NEW 2 BEDROOM APARTMENT  ( 1 WEEK RENT FREE ) Now available is this 2 Bedroom apartments located in well sort after location. The Apartment is located on the 1st and 2nd floor with lift access and balcony of the lounge and another from bedroom.  Located in a small boutique building with security access and also lift and close proximity to shops and transport. One undercover parking space. Small Pets are acceptable based on pet references. ,"['Kitchen', 'Laundry']",6,74,18,1,18,25,75,44,56,20 to 39,"10,352"
