Url,Price,Selling date,Address,Suburb,House Type,Bedrooms,Bathrooms,Parking spots,Land size,Description,Under 20,20 - 39,40 - 59,60+,Long term residents,Owner percent,Renter percent,Family percent,Single percent,Average age,First Listed,Population
https://www.domain.com.au/11a-latvia-avenue-greenacre-nsw-2190-2016392475,980000,Sold by private treaty 28 Jul 2020,11a Latvia Avenue Greenacre NSW 2190,Greenacre ,Semi Detached Houses ,4,3,1,0,"SOLD BY HARCOURTS GREENACRE Brand New Brick Duplex, Sure To Impress Showcasing exquisite finishes of style and luxury throughout, this cleverly architecturally designed home has been crafted with attention to detail and no expense spared, offering the ultimate family lifestyle with undeniable quality and comfort over two luxurious levels. Boasting effortless indoor/outdoor entertaining with a relaxed lifestyle in mind, it is conveniently nestled in a quiet location only moments away from Greenacre &amp; Chullora shops, transportation, private and public schools and parks. - Brand new construction with high quality finishes throughout Contemporary open plan design flowing to expansive covered alfresco entertaining area with kitchenette and barbecue area Four impressively sized bedrooms with built-ins, Master bedroom features ensuite, walk-in robe and private balcony large open plan living and dining areas feature a abundance of natural sun light Stone Gas kitchen with breakfast bar, quality stainless steel appliances and walk in large butlers pantry Sleek fully tiled bathrooms over two levels Zoned ducted air-conditioning, alarm system, video intercom and LED lighting Automatic garage with internal access and ample of storage Immaculate low maintenance landscaped gardens complete with child friendly backyard Minutes walk to Greenacre &amp; Chullora shops, transportation, private and public schools and parks Harcourts Greenacre - A team of leading real estate professionals you deserve.",28,26,26,19,63,38,62,46,54,20 to 39,-1,"24,372"
https://www.domain.com.au/37-stretham-avenue-picnic-point-nsw-2213-2016466005,915000,Sold prior to auction 28 Jul 2020,37 Stretham Avenue Picnic Point NSW 2213,Picnic Point ,Free Standing Houses ,3,2,2,556,]',31,23,29,16,67,85,15,69,31,40 to 59,-1,"6,148"
https://www.domain.com.au/42a-carrington-street-revesby-nsw-2212-2016394187,1060000,Sold by private treaty 28 Jul 2020,42A Carrington Street Revesby NSW 2212,Revesby ,Semi Detached Houses ,5,3,1,349,"Room For The Whole Family This gorgeous home has been built for the largest of families with a welcoming feel and energy that needs to be experienced. Entertain and relax with multiple living areas and an undercover alfresco area designed to make you feel the holiday vibe all year round. * Lavishly designed, near new 5 Bedroom Home, 349sqm * Luxurious master suite with wardrobes &amp; stunning ensuite bathroom * Remaining double sized bedrooms have built in wardrobes  * Soaring high ceilings compliment the stylishly decorated, light filled interiors * State of the art gourmet style kitchen with a sleek design * Upper level family retreat opens to a balcony for guests to enjoy * Bonus study space upstairs * Powerful ducted air conditioning * Private driveway leading to garaging with internal access For further details or to arrange an inspection of this magnificent abode, please do not hesitate to contact exclusive listing agent Dean Owsnett.",26,28,26,20,61,76,24,56,44,20 to 39,-1,"14,189"
https://www.domain.com.au/10-neutral-ave-birrong-nsw-2143-2016260813,1126500,Sold by private treaty 27 Jul 2020,10 Neutral Ave Birrong NSW 2143,Birrong ,Free Standing Houses ,5,3,2,405,"Luxurious Masterpiece in Convenient Locale This luxurious masterpiece of impressive proportions is located in a quiet cul de sac within an easy walk to shops and station. Highlights include; -Five bedrooms main with walk in robe plus ensuite -one bedroom downstairs , perfect for in law accommodation -hostess kitchen with gas cooking and breakfast bar -open plan lounge and dining -upstairs lounge room or retreat -choice of three modern bathrooms, one downstairs -covered alfresco area overlooking sunny backyard -separate laundry plus outdoor kitchen -double lock up garage and land size approximately 405sqm Presented over two sprawling levels with an abundance of living space throughout, it effortlessly accommodates the whole family.",24,28,24,23,66,62,38,47,53,20 to 39,-1,"3,109"
https://www.domain.com.au/17-como-rd-greenacre-nsw-2190-2016218591,770000,Sold by private treaty 27 Jul 2020,17 Como Rd Greenacre NSW 2190,Greenacre ,Free Standing Houses ,3,1,2,607,"Location, Potential &amp; Your Classic family Home Positioned just a short stroll from Chullora Market Place, Malek Fahed Islamic school &amp; Public transportation this freshly painted much loved home sits on approx. 607sqm with plenty of potential to renovate with granny flat (STCA) creating immense appeal for investors and families.  Oozing character and charm this home offers 3 bedrooms, formal lounge room, original kitchen with gas cooktop, separate dining, original bathroom/laundry and a spacious undercover veranda perfect for entertaining.  Book your very own private inspection as this home is sure to impress!",35,28,23,14,70,82,18,55,45,20 to 39,-1,"24,372"
https://www.domain.com.au/5a-centaur-street-padstow-nsw-2211-2016330506,1220000,Sold by private treaty 27 Jul 2020,5A Centaur Street Padstow NSW 2211,Padstow ,Semi Detached Houses ,4,3,2,0,]',23,25,28,24,70,72,28,59,41,40 to 59,-1,"13,313"
https://www.domain.com.au/1-15-baldwin-street-padstow-nsw-2211-2016346370,610000,Sold by private treaty 27 Jul 2020,1/15 Baldwin Street Padstow NSW 2211,Padstow ,Villas ,2,1,1,0,"Full Brick Single-Level Villa Home ~ Walk to Station This well maintained single-level villa home is set in a lovely quiet location, only 7 minutes walk to Padstow train station, schools, shopping centre and parks, and is also only a 10 minute walk to Revesby shopping centre and train station.  Our Favourite Features include:  * Double Brick Construction  * 2 Bedrooms with Built-in Robes * Spacious Open Plan Living * Soaring Cathedral Ceilings * Plenty of Natural Light * Well Maintained Bathroom * Updated Kitchen, Dishwasher * Reverse Cycle Air Conditioning * Front and Rear Courtyards * Lock up Garage plus Car Space * 7 Minute Walk to Station, Schools and Shops Details: Belinda Owsnett - 0417 433 313",21,30,30,19,68,67,33,50,50,40 to 59,-1,"13,313"
https://www.domain.com.au/136-alcoomie-st-villawood-nsw-2163-2016213918,850000,Sold by private treaty 27 Jul 2020,136 Alcoomie St Villawood NSW 2163,Villawood ,Free Standing Houses ,4,2,2,512.5,"MODERN TWO STOREY HOME This stylish ultra-modern smart home approx. 4 years old offers the finest quality fittings and finishes and is sure to tick all the boxes for the growing family. Downstairs offers a large sophisticated open plan living and dining areas with an ultra-modern kitchen with stone bench-tops, walk-in pantry, all stainless-steel appliances. A formal lounge room or 5th bedroom. Large internal laundry, lined press and internal access to the double lock up garage.  Upstairs offers four great size bedrooms, master bedroom with en-suite and two walk-in wardrobes, an ultra-modern family bathroom plus a study/family area.  Outside we have a fantastic entertainment area with a timber decking and pergola.  Other luxuries include, security alarm system, roller shutter all windows downstairs, ducted air-conditioning, low maintenance front yard and an easy garden, and much much more Located in a quiet location filled with privacy within a short walk to Villawood Shopping Centre, train Station, Schools and parks.  Don\'t miss out on this one! Opportunities like this don\'t come up often! Approx Land Size: 512sqm Address: 136 Alcoomie St, Villawood  inspection by Appointment only Contact ALLEN ABED ON 0421 531 360 OR LE LY ON 0422 432 057 to make an appointment for inspection",25,21,31,22,70,11,89,37,63,-1,-1,-1
https://www.domain.com.au/124-johnston-road-bass-hill-nsw-2197-2016291083,1100000,Sold at auction 26 Jul 2020,124 JOHNSTON Road Bass Hill NSW 2197,Bass Hill ,Free Standing Houses ,4,3,3,556,"COMPLETE PACKAGE - POSSIBLE DUAL INCOME! Looking for a property that ticks all the boxes then this is the one for you. The home of solid build is less than 20 years old and has enormous potential for a large family that likes to entertain. There is even a option to rent out the lower part of the home separate, or make into a self contained flat.  Features Include: * Attractive home with multiple living areas * Massive open living with fomal dining  * Just move in - all work has been done for you * Intenal and external access to lower part of home which has own living and dining and bedroom and amenities. * Rear private large entertaiment area with access to large salt water in ground pool * Large driveway access for many cars off the road and lock up into garage with workshop area * All this just down the road from the famous Bass Hill Plaza and local amenities and on the high side of the street.",25,27,22,25,76,85,15,58,42,20 to 39,-1,"9,071"
https://www.domain.com.au/10-dutton-street-bankstown-nsw-2200-2016340637,856000,Sold at auction 25 Jul 2020,10 Dutton Street Bankstown NSW 2200,Bankstown ,Free Standing Houses ,3,1,1,562.8,"First Time Offered &amp; Must Be Sold This well maintained three-bedroom home poised on 562.8m2 of prime real estate with a 16.15m offers the potential to construct a duplex or granny flat (STCA). For those developers who have their hands full with other projects this property is fit for the rental market so buy it whilst it\'s available and rent it out until you\'re ready to develop. Located in one of the best streets and only moments to the heart of Bankstown &amp; Yagoona\'s CBD, Transport and the area\'s finest schools this much loved family home is a must to inspect. Other features include: - Three well-proportioned bedrooms Original kitchen combined with the dining area Separate living/family room Neat &amp; tidy bathroom Internal laundry with ample storage Driveway access to a single lock-up garage Large yard great for entertaining and the kids to enjoy Clear of any easements and only a sewer connection point on the left of the block",24,25,26,25,69,64,36,57,43,20 to 39,-1,"32,116"
https://www.domain.com.au/21-mccrossin-avenue-birrong-nsw-2143-2016340993,865000,Sold at auction 25 Jul 2020,21 McCrossin Avenue Birrong NSW 2143,Birrong ,Free Standing Houses ,3,2,3,556,]',23,25,29,23,81,84,16,56,44,20 to 39,-1,"3,109"
https://www.domain.com.au/59-weemala-road-chester-hill-nsw-2162-2016339553,855500,Sold at auction 25 Jul 2020,59 Weemala Road Chester Hill NSW 2162,Chester Hill ,Free Standing Houses ,3,1,3,556.4,"Perfect Family Home or Investment Perfectly positioned and only moments away from all that Chester Hill has to offer is this well-presented family residence which offers functional family living in a convenient location. Set on 556.4sqm with a 17.6 metre frontage, this home offers three bedrooms with built-in wardrobes, well maintained kitchen with dining, neat &amp; tidy bathroom, spacious family room, internal laundry and a three car lock-up garage. But what makes this home so special, is over 55sqm of alfresco living perfect for entertaining guests which also includes an in-built woodfired pizza oven great for entertaining. This property is perfect for both those seeking a new family home or a smart investment. Inspection is highly recommended.",28,28,24,20,69,76,24,52,48,20 to 39,-1,"12,823"
https://www.domain.com.au/69-manahan-street-condell-park-nsw-2200-2016340602,825000,Sold at auction 25 Jul 2020,69 Manahan Street Condell Park NSW 2200,Condell Park ,Free Standing Houses ,6,2,1,799,"Beautiful Corner Block Approx 799sqm Located only moments away from local schools &amp; shopping centre, this lovely 2 storey home is perfect for anyone wanting to build their dream home or simply renovate to their delight.  Upstairs:   - 3 bedrooms with built in robes  - Bathroom with separate toilet  - Spacious family room with balcony providing distant views Downstairs:   - Formal lounge and Dining  - Spacious kitchen with electric appliances  - 3 good sized bedrooms  - Bathroom with shower, bathtub, vanity &amp; separate toilet  - Good sized laundry  - Single lock up garage Potential Duplex site! (STCA) Land size 21.33 frontage with 799sqm in total.",36,31,22,12,75,74,26,59,41,20 to 39,-1,"11,564"
https://www.domain.com.au/4-103-cragg-street-condell-park-nsw-2200-2016338331,725000,Sold at auction 25 Jul 2020,4/103 Cragg Street Condell Park NSW 2200,Condell Park ,Villas ,3,1,2,0,"AUCTION ON SITE THIS SATURDAY AT 10.30AM Light &amp; Bright Modern Villa in Central Location Ideally positioned at the rear of this boutique complex of only 4, this impressively presented stylish Villa home offers a low maintenance lifestyle you cannot refuse. Showcasing a sundrenched free flowing floorplan, this pristine residence is ideal for the first home buyer, young family, the astute investor or those looking to downsize. Located just moments to a myriad of ultra convenient amenities, this beautiful home features:  Open living and dining with tiled flooring throughout  Three generous and spacious bedrooms all with built in robes, Master with ensuite style W/C  Well maintained main bathroom with shower and bath tub  Enormous modern kitchen with quality appliances, granite benchtop and breakfast bar  Fantastic covered and paved alfresco perfect for year round entertaining  Secure double lock up auto garage with internal access  Quality Inclusions: Two split reverse cycle air conditioning systems and internal laundry  Only moments away from parkland, local schools, Condell Park shopping village, Bankstown CBD and public transport links",29,24,28,19,72,70,30,53,47,20 to 39,-1,"11,564"
https://www.domain.com.au/9-northcote-road-greenacre-nsw-2190-2016312910,1710000,Sold at auction 25 Jul 2020,9 Northcote Road Greenacre NSW 2190,Greenacre ,Free Standing Houses ,5,4,4,0,"A New Benchmark for Quality Design and Family Luxury Showcasing impressive finishes of architectural and interior design, this luxury residence sets a new benchmark in contemporary living and class. Its located in a sought after location and opposite a park and minutes drive to all local amenities. - Five spacious bedrooms with built in robes Master bedroom with large walk in robe, contemporary en suite and private balcony Bedroom downstairs for in-law accommodation or study/office Five contemporary styled bathrooms Gourmet inspired Chef\'s kitchen with quality stainless steel appliances, island bench tops, gas cooking and spacious butlers pantry Multiple over-sized formal and informal living areas Spacious manicured yard with plenty of room to move Double lock-up garage with internal access and storage area Entertaining alfresco room with bathroom and under cover area Media room with kitchenette and entertaining under cover area Close to all local amenities that Greenacre/Chullora have to offer Harcourts Greenacre - A team of leading real estate professionals you deserve",27,33,23,17,79,77,23,48,52,20 to 39,-1,"24,372"
https://www.domain.com.au/44-northcote-road-greenacre-nsw-2190-2016348284,1000000,Sold at auction 25 Jul 2020,44 Northcote Road Greenacre NSW 2190,Greenacre ,Free Standing Houses ,2,1,1,619.7,"Build your dream home or duplexes on 619.7sqm Set on one of the district\'s best streets on a massive north facing block, this neat and tidy home is ready to move straight into and enjoy while offering scope for future capitalisation. Appealing to developers and families looking to build a dream home and with duplex potential (STCA), the property is conveniently placed only moments from shopping precincts, schools, and transport. Fast-track your building plans through the complying development certificate approval from the new Low Rise Housing Diversity Code now in effect.  - Interiors are generously proportioned and in excellent condition Level layout with large living plus separate dining or third bedroom Huge level backyard provides plenty of space to expand/build upon Contemporary functional kitchen is appointed with stone benchtops Two good sized bedrooms are complemented with built-in wardrobes Main bathroom with spa, separate spacious internal laundry Air con, timber floors, combustion fire, carport, and storage/workshop  Near supermarkets, cafes, local eateries, buses and arterial roads",33,25,22,19,73,84,16,64,36,20 to 39,-1,"24,372"
https://www.domain.com.au/19-mount-lewis-avenue-punchbowl-nsw-2196-2016357176,871000,Sold at auction 25 Jul 2020,19 MOUNT LEWIS Avenue Punchbowl NSW 2196,Punchbowl ,Free Standing Houses ,3,2,2,505,"SOLID HOME IN A 5 STAR LOCATION THAT NEEDS A LITTLE TLC! Grab this HOT property before its gone, located in a highly sought after spot within walking distance to local schools, station, shops and places of worship. House is a full brick home on the high side of the street with 3 bedrooms and a sunroom. * Separate lounge and dining rooms * Large kitchen * 2 bathrooms and 2 toilets * Outside huge rear rumpus room / storage / or possible accom * Inground swimming pool * Rear back shed * The location is key - Will be SOLD!",29,27,24,20,79,79,21,51,49,20 to 39,-1,"20,242"
https://www.domain.com.au/4-18-20-hydrae-street-revesby-nsw-2212-2016340535,745000,Sold at auction 25 Jul 2020,4/18-20 Hydrae Street Revesby NSW 2212,Revesby ,Villas ,3,2,2,230,"Oversized Villa, immaculately presented within walking distance to Station &amp; Shops Immaculately maintained throughout with bright &amp; spacious interiors along with durable finishes, this impeccable villa defines family living perfect for entertainers, first home buyers, downsizers, or growing families. This oversized villa to call home is situated in a secure and well-maintained boutique complex which is manicured to the highest of standards with low strata. This Villa has a unique setting giving a lot of privacy for the new owners as the only common wall is adjoining to the lock up garage. - Three bedrooms, two with built-ins Master with en-suite Neat &amp; tidy main bathroom Well-presented kitchen with quality appliances, finished with stone benchtops &amp; breakfast bar Huge open living &amp; dining areas with an abundance of natural sunlight Private &amp; spacious courtyard with undercover entertaining area Other features include split system air-conditioning, drive through lock-up garage with internal access, security shutters all round, security alarm system and freshly painted throughout. Ideally located, close to local schools, shops, parks and public transport. So whether it be an investment or a place to call home, we highly recommend you come out to inspect.",22,23,24,31,56,77,23,57,43,20 to 39,-1,"14,189"
https://www.domain.com.au/55-lawford-street-greenacre-nsw-2190-2016287258,890000,Sold by private treaty 24 Jul 2020,55 Lawford Street Greenacre NSW 2190,Greenacre ,Free Standing Houses ,6,2,4,525,"UNDER CONTRACT BY BEGETIS ESTATE AGENTS Quietly positioned in an elevated leafy setting with sundrenched aspect close to Chullora Marketplace, is this large &amp; immaculately presented two storey family residence set on approximately 525m2 with a 13.41m frontage.  * 6 bedrooms, spacious lounge &amp; dining, upstairs family room leading out to balcony * Large updated kitchen + dishwasher &amp; breakfast bar, 2 bathrooms + 3rd toilet, air con * Side drive to double carport, grassed yard + pergola &amp; large retreat/storage room * Close to shopping village, transport, sought after schools, parkland &amp; all amenities",33,30,22,15,79,48,52,50,50,20 to 39,-1,"24,372"
https://www.domain.com.au/1-22-24-chiswick-road-greenacre-nsw-2190-2016344102,645000,Sold by private treaty 24 Jul 2020,1/22-24 Chiswick Road Greenacre NSW 2190,Greenacre ,Villas ,3,1,2,179,"OPEN HOUSE CANCELLED - UNDER CONTRACT Perfectly positioned in a quiet tree lined street, this spacious street facing villa is perfect for the first home buyer or investor. Featuring: 3 bedrooms, all with built-in wardrobes, open plan lounge/dining area, tiled flooring throughout, modern kitchen with dishwasher and stone benchtops. Bathroom with extra toilet, internal laundry and 2 x air-conditioners. Externally the home features: Tandem double lock-up garage, private undercover rear yard and garden shed. Located within walking distance to Greenacre shopping centre, cafes and restaurants. Transport made easy with the M90 bus stop allowing easy access to Strathfield, Bankstown and Burwood train stations. Currently leased for $560 per week (lease expired).",24,26,29,20,69,78,22,50,50,20 to 39,-1,"24,372"
https://www.domain.com.au/127-wilbur-street-greenacre-nsw-2190-2016363833,1170000,Sold by private treaty 24 Jul 2020,127 Wilbur Street Greenacre NSW 2190,Greenacre ,Duplexes ,4,2,2,0,"SOLD by Muhammad Sarmini 0403 750 917 Exquisite High End Quality, Impressive Style &amp; Luxury Offering a sublime architectural design spanning across three magnificent levels, this stunning masterpiece provides luxurious living beautifully crafted with high end finishes and meticulous attention to detail throughout. Showcasing unrivaled quality and impressive workmanship, this full brick premiere Duplex with a gorgeous faade encompasses bright and ambient interiors and a favourable sun bathed north east aspect. The impeccable standard of both indoor and outdoor living spaces is ideal for the modern family lifestyle. - Four (4) spacious bedrooms, 3 with custom joinery built-ins including master bedroom with walk-in robe, deluxe ensuite and balcony Generous home office/large study downstairs features large built-in desk with drawers and convenient storage shelves Formal living area upon entry leading to pleasant covered front verandah Sleek and stylish designer Caesar stone kitchen with island breakfast bar, gas cooktop and premium Bosch appliances Spacious open plan family room and dining area with custom feature timber wall seamlessly flowing to outdoors, immaculate child friendly rear yard Three (3) lavish hotel style bathrooms includes powder room downstairs, main with freestanding bath, frameless glass finishes, stylish internal laundry Zoned ducted air conditioning, built-in surround sound speakers, security intercom and alarm system Feature staircase with gleaming hardwood timber floors, frameless glass finishes Exceptional quality Travertine tiled floors throughout lower level, quality hardwood timber floors on upper level Superb oversized covered entertaining area with timber decking, automatic roller blinds, stainless steel kitchenette with ceramic cooktop, bar fridge, Zip hydro tap hot and cold drink dispenser Double basement remote lock up garage, ample storage space with built-in cupboards and benchtop, beautifully landscaped gardens Conveniently located to nearby Greenacre shopping facilities, a variety of sought after local schools, public transport, cafes, restaurants and parklands, this is an ideal opportunity to acquire a superior family home. Address: 127 Wilbur Street, Greenacre For Sale: SOLD Inspect: Saturday Open Home Cancelled  Contact: Muhammad Sarmini 0403 750 917 or muhammad@ljhbl.com.au Like and follow us on facebook, twitter, instagram and youtube",34,27,24,15,63,59,41,56,44,20 to 39,-1,"24,372"
https://www.domain.com.au/3-lawford-street-greenacre-nsw-2190-2016399180,971000,Sold by private treaty 24 Jul 2020,3 Lawford Street Greenacre NSW 2190,Greenacre ,Semi Detached Houses ,4,3,1,368,"Brand New With Swimming Pool Located just a stones throw from South Strathfield is this luxurious and practical brand new duplex. Positioned at the end of a cul-de sac in a private and quiet setting. Featuring: 4 good sized bedrooms, built-in wardrobes, main bedroom with en-suite, ultra-modern style kitchen with stone benchtops and dishwasher, formal lounge room, open plan family/dining area, designer main bathroom, laundry, downstairs bathroom with shower and toilet. Bonus features include: In-ground salt water swimming pool, ducted air-conditioning, security alarm and video intercom system. Externally the property features: Undercover entertainment area with kitchenette that includes a BBQ. Lock-up garage with internal access and easy care landscaped gardens. Situated in a handy location within a short walk to schools, bus stop and Chullora Market Place.",36,25,25,14,63,64,36,59,41,20 to 39,-1,"24,372"
