Url,Price,Selling date,Address,Suburb,House Type,Bedrooms,Bathrooms,Parking spots,Land size,Description,Under 20,20 - 39,40 - 59,60+,Long term residents,Owner percent,Renter percent,Family percent,Single percent,Average age,First Listed,Population
https://www.domain.com.au/48-darling-street-glebe-nsw-2037-2016082664,1499000,Sold at auction 22 Aug 2020,48 Darling  Street Glebe NSW 2037,Glebe ,Free Standing Houses ,4,3,1,0,"Smart urban style in a fully renovated terrace This attractive inner-city terrace has been cleverly updated and designed to deliver a versatile living space in the heart of Glebe. It provides a quality home that is freshly appointed throughout and features a user-friendly multi-level floorplan with excellent natural light, privacy and many flexible layout options. This quiet street setting is also very conveniently situated with easy access to Glebe Point Road cafes, boutiques and dining options, with the Blackwattle Bay foreshore just around the corner. - A bright open plan design includes a renovated gas kitchen Formal lounge/fourth bedroom plus a finished attic level office Upstairs bedrooms include a main with ensuite and built-ins Private BBQ deck and courtyard plus a large rear terrace Lock-up garage with access from the back lane Separate downstairs bedroom and bathroom, ideal for an AirBnB rental Full main bathroom plus an extra WC and internal laundry Potential garage roof top (STCA) Short stroll to light rail and 10 minute walk to Sydney Fish Markets &amp; University Of Sydney",18,40,23,19,52,39,61,34,66,20 to 39,-1,"11,537"
https://www.domain.com.au/3-campbell-street-glebe-nsw-2037-2016394970,916000,Sold at auction 22 Aug 2020,3 Campbell Street Glebe NSW 2037,Glebe ,Free Standing Houses ,1,1,0,86.8,]',15,26,24,35,66,4,96,20,80,20 to 39,-1,"11,537"
https://www.domain.com.au/28-rogers-avenue-haberfield-nsw-2045-2016401107,2640000,Sold at auction 22 Aug 2020,28 Rogers Avenue Haberfield NSW 2045,Haberfield ,Free Standing Houses ,4,2,2,784,"Generously scaled freestanding full brick residence Occupying sizeable park-like grounds in a premier Haberfield address, this freestanding home presents multiple living areas, oversized rooms and a spacious rear garden. It\'s located on a tree lined street within footsteps of shops, restaurants and schools. - Immaculately presented and ready to move straight into  Incredible scope to add value with personal modern touches Ideal opportunity to capitalise on 784sqm blue ribbon parcel Formal lounge and large family room overlooking the gardens A bright dine-in kitchen adjoins the spacious dining room The gracious entry foyer leads to four oversized bedrooms Internal laundry plus two bathrooms, main includes bathtub Solid full brick construction, complete with a large cellar Double garage, workshop, multiple off street parking spaces Enjoy the many attractions of this highly convenient location",22,24,23,31,73,71,29,50,50,40 to 59,-1,"6,469"
https://www.domain.com.au/220-illawarra-road-marrickville-nsw-2204-2016410707,1350000,Sold at auction 22 Aug 2020,220 Illawarra Road Marrickville NSW 2204,Marrickville ,Free Standing Houses ,2,1,1,183,"Updated classic house on 183sqm block A semi-detached house on 183sqm of land, this updated classic ticks plenty of boxes. An open-plan design with well maintained interiors, enjoy idyllic Inner West living. Free Building &amp; Pest Report: bw.com.au. Private inspections available, or see scheduled open times. Highlights * Semi-detached w/ NE facing windows * Walk to cafes, dining &amp; transport * Polished floorboards, decorative ceilings * Gas kitchen, stainless steel appliances * Timber concertina doors to the backyard * Rear access for parking, garden shed * Ornate fireplace, split a/c, ceiling fans * Updated bathroom w/ tub, built-in robe * An oversized 50sqm attic storage space * Located in the heart of Marrickville",21,33,29,17,56,59,41,51,49,20 to 39,-1,"26,607"
https://www.domain.com.au/239-livingstone-road-marrickville-nsw-2204-2016396140,1550000,Sold at auction 22 Aug 2020,239 Livingstone Road Marrickville NSW 2204,Marrickville ,Free Standing Houses ,4,2,0,291,"Sensational semi, inspired renovation and extension on 291sqm **PLEASE NOTE ONLY REGISTERED BIDDERS WILL BE ALLOWED ON SITE &amp; 1.5m SOCIAL DISTANCING RULES WILL BE ENFORCED ON AUCTION DAY** What presents as a traditional semi opens to reveal a substantial family home of surprising space and style. A stunning extension and renovation were undertaken just 5 years ago creating light drenched vast living and dining spaces that rest under soaring double height ceilings, a wonderful designer kitchen that is a real gathering space and impressive entertainers\' terrace with outdoor kitchen. The upper level was given over to parental indulgence providing a wonderful retreat for rest and relaxation. The artistic fusion of new and old design creates a home with a very welcoming feel and a family-focused layout. Fall in love with this stunner that\'s walking distance to the village, bus, rail, and schools. Double glazed and whisper quiet interiors throughout Timber floorboards, high ceilings, some decorative Open plan living/dining, smart lights in living Deluxe kitchen with gas cooktop and island breakfast bar Stone benches, Miele appliances, built-in coffee machine Vast double height ceilings, abundance of natural light Wall of bi-folds opens to the covered alfresco terrace Built-in outdoor kitchen with barbeque and wok burner Heat lamps, level lawns, garden shed, storage areas Large bedrooms, all with robes, study nook area, a/c Whole floor master, mezzanine style, plantation shutters Designer bathrooms, internal laundry, lined attic storage Equidistant to both Marrickville and Dulwich Hill stations Walk to Cooks River parks &amp; Marrickville West Primary",22,27,30,21,70,67,33,49,51,20 to 39,-1,"26,607"
https://www.domain.com.au/29-hordern-street-newtown-nsw-2042-2016410812,1815000,Sold at auction 22 Aug 2020,29 Hordern Street Newtown NSW 2042,Newtown ,Free Standing Houses ,3,1,1,95,]',11,45,31,12,40,43,57,45,55,20 to 39,-1,"15,027"
https://www.domain.com.au/163-alice-street-newtown-nsw-2042-2016396021,1250000,Sold at auction 22 Aug 2020,163 Alice Street Newtown NSW 2042,Newtown ,Free Standing Houses ,2,1,1,0,"Fresh Modern Style, Delightful Terrace **PLEASE NOTE ONLY REGISTERED BIDDERS WILL BE ALLOWED ON SITE &amp; 1.5m SOCIAL DISTANCING RULES WILL BE ENFORCED ON AUCTION DAY** Freshly schemed interiors with an appealing blend of contemporary and period style create a welcoming ambience for this bright Newtown terrace. Spilling across its generous northerly to rear block, it opens to a delightful courtyard, edible gardens and Alice Avenue access to its lock up parking. The clever floor plan boasts modern appointments, a spacious home office nook and a unique large loft 2nd bedroom with library wall and abundance of storage. Current DA approval is held for a reconfiguration and enhancement. This perfect address is central to Marrickville Metro, the Annette Kellerman Aquatic Centre and all the joys of bustling King Street. Walk to both the bus and rail. - Screened from the street, front courtyard High ceilings, timber floors, rear lane access Generous casual living, adjoining home office Separate dining room, skylight, stone kitchen Smeg dishwasher, fresh and modern bathroom Spacious rear alfresco courtyard, edible gardens Lower level master with fan and built-in robes Large loft bedroom with library wall and storage Easy Alice Avenue access to the lock up parking Enjoy as is with scope to add further value NB: LJ Hooker Newtown cannot guarantee the information provided. Interested parties must rely on their own enquiries.",23,32,37,9,46,46,54,54,46,20 to 39,-1,"15,027"
https://www.domain.com.au/19-sibbick-street-russell-lea-nsw-2046-2016395251,2205000,Sold at auction 22 Aug 2020,19 Sibbick Street Russell Lea NSW 2046,Russell Lea ,Free Standing Houses ,4,2,3,461,"Timeless family residence with private indoor/outdoor living Blending old world character and modern comfort, this sophisticated residence is treasure that delivers clever contemporary renovations without compromising any of its timeless charm.  The interiors are washed with an abundance of natural light and are enhanced with retro, period details that extend out to a landscaped private garden. It\'s situated in a highly sought-after lifestyle address, just footsteps from waterfront parklands, premier schools and local restaurants. - Sleek single level design offers a spacious open lounge/dining area Seamless outdoor flow onto a partially covered entertaining area Ultimately private alfresco space boarded by manicured gardens Stylish open plan kitchen features gourmet steel gas appliances Four good-sized bedrooms, master is fitted with a built-in wardrobe Two bathrooms with floor to ceiling tiles, LED downlights, alarm Formal dining with an ornate fireplace and a timber bay window Timber flooring paired with high ceilings and stain glass windows Single lock-up garage with ample off street parking for two cars Moments from celebrated cafes, eateries, buses, shops and grocers",28,19,31,22,77,86,14,65,35,40 to 59,-1,"4,999"
https://www.domain.com.au/6-durham-street-stanmore-nsw-2048-2016404421,1225000,Sold at auction 22 Aug 2020,6 Durham Street Stanmore NSW 2048,Stanmore ,Free Standing Houses ,2,1,0,0,]',26,33,27,14,46,65,35,56,44,20 to 39,-1,"7,950"
https://www.domain.com.au/38-mosely-street-strathfield-nsw-2135-2016401718,2925000,Sold at auction 22 Aug 2020,38 Mosely Street Strathfield NSW 2135,Strathfield ,Free Standing Houses ,4,2,2,651,]',13,48,20,18,57,50,50,42,58,20 to 39,-1,"25,803"
https://www.domain.com.au/45-college-street-balmain-nsw-2041-2016451874,1475000,Sold by private treaty 21 Aug 2020,45 College Street Balmain NSW 2041,Balmain ,Free Standing Houses ,2,1,0,139,"Offered with DA approved plans A freestanding character cottage offered with valuable DA-approval for an impressive 3-bed/2-bath renovation. Meanwhile, enjoy generous open living and natural light, ideally positioned between the Darling Street village heart and harbour-side Mort Bay Park. Highlights * Northwest-facing weatherboard cottage * DA approval for 3-bed/2-bath renovation  * High ceilings, fresh paint, leadlight w/ds * Open living, timber floorboards/carpet * Beamed cathedral ceilings, inset glass * Tidy gas kitchen w/ freestanding stove * 2 beds, bath w/ tub, concealed laundry * Private &amp; lush courtyard full of charm * Quiet st opp Royal Oak pub, playground * Edge of Birchgrove, walk to ferry, cafes",23,20,36,21,47,61,39,64,36,40 to 59,-1,"10,456"
https://www.domain.com.au/142-wigram-road-forest-lodge-nsw-2037-2016295391,1800000,Sold by private treaty 21 Aug 2020,142 Wigram Road Forest Lodge NSW 2037,Forest Lodge ,Free Standing Houses ,3,2,0,166,"Charm-filled residence with leafy district views This grand circa 1912 semi-detached residence is to be sold for the first time in almost 38 years, and presents a rare opportunity to acquire a substantial charming residence in one of Sydney\'s most tightly held city-fringe pockets. Within walking distance to Glebe and Annandale village, Sydney University, Tramshed dining, and near highly regarded Forest Lodge Public School, the home features peaceful interiors with traditionally oversized rooms complemented by an open plan lounge dining that flows to a large private and leafy alfresco deck. Beautifully maintained and full of timeless appeal, it promises a lifestyle of opulent space and outstanding convenience. - Open plan galley style gas kitchen with breakfast bar Two bathrooms, including bath Three bedrooms, two upstairs with fans, air conditioning and timber floors Easy stroll to the vibrant Tramshed , Rozelle Bay foreshore and light rail station Spacious open plan lounge dining with executive study nook Moments to universities, sought-after schools and transport Elevated position that captures a leafy outlook over the surrounding district An abundance of storage areas inside and out Rates: Water $219pq, Council $304pq, 166m2 land size Explore the cultural diversity of Glebe Point Road and Annandale village on foot, and just moments to premier amenities, transport, universities, and sought-after schools.",14,54,23,9,57,30,70,53,47,20 to 39,-1,"4,584"
https://www.domain.com.au/133-young-street-annandale-nsw-2038-2016458938,1460000,Sold by private treaty 20 Aug 2020,133 Young Street Annandale NSW 2038,Annandale ,Free Standing Houses ,3,1,0,0,"Set on one of Annandale\'s premier streets Undeniably impressive this striking residence features impeccably presented interiors redesigned for a modern lifestyle, with refreshing openness, fabulous natural light with freshly painted walls and flowing living spaces. Elegantly reinvigorated interiors, high ceilings, polished floors Air conditioned living flows seamlessley to landscaped courtyard Slick CaesarStone/gas kitchen, separate living spaces, alarm Contemporary modern bathroom, internal laundry, ample storage Plantation shutters, ornamental fireplaces and freshly painted A wide street setting with plentiful on street parking Superbly set moments to Booth Street shops, cafes, transport",21,27,30,22,51,61,39,57,43,-1,-1,-1
https://www.domain.com.au/17-webb-street-croydon-nsw-2132-2016367106,1820000,Sold by private treaty 20 Aug 2020,17 Webb Street Croydon NSW 2132,Croydon ,Free Standing Houses ,4,2,4,878.9,"Potential Packed Residence Set On Over 870 Sqm Approx! Positioned in a prime street setting within walking distance to Croydon station and The Strand is this impressive double front federation home on approximately 878.9 sqm land. Its traditional floor plan with four spacious bedrooms and two bathrooms are enhanced by spacious living and dining areas which all step out onto an extremely deep rear yard with lock up garage and a shared side drive offering multiple parking spaces or the opportunity to extend and add your own touches STCA. Now featuring:  Four spacious bedrooms  Bonus study room Sun filled living room  Neat kitchen  Open Plan dining area  Two well positioned bathrooms Rear undercover patio External laundry with second in-built kitchen (gas)  Lock up garage for multiple parking spaces  Extended deep rear yard with rear garden shed  Land Size: 878.9 sqm approx Summary: A quiet tree lined street combines with a large home only a short stroll to both Centenary &amp; Blair Parks, Burwood Girls High School, shops, Westfield and only approx 700m to Croydon Station. Inspect: As advertised  Contact: Marco Errichiello 0414 433 318 Matthew Nolan 0414554322",19,32,20,29,64,74,26,51,49,40 to 59,-1,"10,608"
https://www.domain.com.au/29-renwick-street-leichhardt-nsw-2040-2016433199,1030000,Sold by private treaty 20 Aug 2020,29 Renwick Street Leichhardt NSW 2040,Leichhardt ,Free Standing Houses ,2,1,0,145,"Position Perfect Inner west buyers looking for a well-presented terrace style comfortable home in a great Leichhardt location would be hard pressed to find better value than this featured property. Smartly updated throughout and designed for an easy-care lifestyle, it offers a bright functional single level floor space that\'s perfect for those that love low maintenance living. It also enjoys a blue chip location with Norton Street attractions, Petersham train station, cafes and all within short walking distance. * A functional layout with open lounge room and dining area * Updated kitchen equipped with a dishwasher and gas cook-top * North-east facing back yard space and outdoor entertaining area * Two double bedrooms with timber floors * Ready now to move in and enjoy with minor touch ups needed to transform",17,45,27,10,24,31,69,50,50,20 to 39,-1,"14,625"
https://www.domain.com.au/28-brooklyn-street-tempe-nsw-2044-2016409464,1630000,Sold at auction 20 Aug 2020,28 Brooklyn Street Tempe NSW 2044,Tempe ,Free Standing Houses ,3,1,0,385,"Renovated double-fronted freestanding family home on a huge 385sqm block Set on one of Tempes most sought after streets and a huge 385sqm block, this double fronted, newly renovated and charming family home features light, spacious proportions together with beautifully landscaped outdoor areas. Ready to move in and be enjoyed, this Inner West home is set in a friendly, quiet street and is only a few steps to local schools, cafs, trains, parks and riverside walks, creating the perfect oasis nestled in a prized location.  Generously proportioned living and outdoor spaces  3 great-sized bedrooms with high ceilings, built-in robes and brand-new secure windows. Two rooms with original fireplaces and master with rare pressed ceiling  A versatile, large fourth room that can be used as a 4th bedroom, home office, formal dining room or kids playroom  Polished hardwood floors  Modern bathroom with bathtub, toilet and shower  Separate laundry featuring additional toilet and storage  Huge kitchen with generous bench space, gas cooking and quality oven, cooktop and dishwasher  Large open-plan lounge and dining with reverse-cycle air conditioning  Bright and light-filled sunroom leading out to a beautifully landscaped and private backyard, perfect for kids and entertaining  Garden oasis features a level lawn, established trees and hedges, a vegetable patch / flower garden along with a near-new shed  Inviting and established front garden with timber deck and low-maintenance pathways  Extensive storage throughout  Only 8km from the CBD minutes walk to Tempe or Sydenham Station (2 stops to central) and soon to open Sydney Metro line (Chatswood to Bankstown)  Close to Wolli Creek and Marrickville Metro and easy access to Sydney Park, King St, Enmore Rd and Marrickville Rd shops and eateries  In the catchment zone for the sought-after selective Tempe High School",30,21,33,15,64,78,22,55,45,20 to 39,-1,"3,548"
https://www.domain.com.au/31-susan-street-annandale-nsw-2038-2016464270,2550000,Sold by private treaty 19 Aug 2020,31 Susan Street Annandale NSW 2038,Annandale ,Free Standing Houses ,3,2,0,370,"Architecturally designed oasis of style, size and design Displaying an inspired transformation by architect Christopher Polly, this classically presented cottage on 370sqm has been completely renewed and extended to provide a quality two-level home behind its original period facade. It offers a very unique property that embraces easycare living and in/outdoor entertaining with an intelligent use of space, excellent natural light and an ultra-private location that\'s perfect for enjoying Annandale\'s lifestyle. All the hard work has been done to make this a fantastic home; it is now ready to move into and enjoy with nothing more to do or spend. - Set on a deep 370sqm land parcel with an established rear garden Cleverly designed to maximise sunlight and peaceful leafy surrounds Interiors are fresh, bright and supremely easy-to-maintain throughout Generous formal lounge plus a downstairs open casual living space Fold-out doors that open onto the garden and entertainment patio Three double bedrooms with built-ins plus separate home office Designer Corian kitchen, underfloor heating and air conditioning  A quiet position with plenty of street parking available",22,34,30,14,51,54,46,55,45,-1,-1,-1
https://www.domain.com.au/23-archer-street-burwood-nsw-2134-2016298063,1575000,Sold by private treaty 17 Aug 2020,23 Archer Street Burwood NSW 2134,Burwood ,Free Standing Houses ,3,1,2,360,"Easy single level living in a smart character cottage Located for lifestyle and smartly updated for today\'s living, the well-appointed \'Maid Stone Cottage\' will appeal to a range of buyers with its easy maintenance layout and great convenience to all of Burwood\'s amenities. The property combines practicality with style and features plenty of modern updates plus a good-sized backyard for entertaining.  Inside is light filled throughout with a generous layout featuring separate lounge and dining areas, high 3m ceilings, ducted air conditioning , combustion wood fireplace and polished timber floors. There are built-in robes all three bedrooms plus there is a well-appointed kitchen with granite bench tops and gas fittings,modern bathroom, laundry and extra toilet. The home sits on a deep 360sqm level block with a double garage and side car access from New Street around the corner. There is also a large outdoor pergola that\'s perfect for entertaining and a private grassed garden, ideal for kids and pets. This popular neighbourhood is within easy walking distance to all of the area\'s main attractions including Westfield Burwood, the train station, parks and a choice of quality schools, and will be accessible to the future Metro station at North Burwood.",14,41,26,19,70,63,37,43,57,20 to 39,-1,"16,011"
https://www.domain.com.au/4-waratah-street-croydon-park-nsw-2133-2016313872,1043000,Sold by private treaty 17 Aug 2020,4 Waratah Street Croydon Park NSW 2133,Croydon Park ,Free Standing Houses ,4,2,3,0,"A Land Value Opportunity At An Affordable Price This most affordable opportunity will not last- so be quick!  Perfectly located right on the border of Burwood Heights on an elevated northern corner block is this affordable land value opportunity offering potential to re-build your dream home (S.T.C.A.) Available for the first time in over 50 years and currently featuring a totally original weatherboard cottage with 4 bedrooms plus a study, a basic kitchen and bathroom, separate living areas and a low maintenance rear garden. Secure off street parking is also available with dual driveways via both Waratah Street to a carport and Arthur Street to a double lock up garage. This is the opportunity you\'ve been waiting for in a highly desirable central location within a short stroll to beautiful Henley Park and within close proximity to Burwood, Croydon &amp; Croydon Park shops, schools &amp; transport.  Land 366.7m2",25,28,27,20,66,85,15,55,45,40 to 59,-1,"11,017"
https://www.domain.com.au/22-the-boulevarde-lilyfield-nsw-2040-2016391526,1950000,Sold at auction 17 Aug 2020,22 The  Boulevarde Lilyfield NSW 2040,Lilyfield ,Free Standing Houses ,4,2,2,190,"A family sized contemporary terrace Perfectly configured for family living, this Torrens-titled home combines quality design with a highly functional layout designed to embrace a sunny level garden. Recently refurbished Interiors offer a spacious layout over two levels, with around 250sqm of in/outdoor living space, combined with rear access to secure garage plus off-street parking makes it a desirable opportunity for families. On a wide tree-lined avenue close to Callan Park, popular local cafes and Orange Grove markets, the impeccably presented four-bedroom home is 550m to the light rail for an easy commute to the city.  - 3 double bedrooms with built-ins, 4th bed/home office Master suite with a balcony capturing city skyline views Dual street access, refreshed interiors, family-focused layout Black granite kitchen, Miele dishwasher, breakfast bar Bright and spacious living and dining, new oak timber floors Travertine terrace and a level child-friendly grassed garden  2 bathrooms, powder room, internal laundry, ducted air  Lock-up garage plus off-street parking via Carrington Street",32,20,37,12,52,71,29,57,43,-1,-1,-1
https://www.domain.com.au/45-cambridge-street-rozelle-nsw-2039-2016401648,1650000,Sold prior to auction 17 Aug 2020,45 Cambridge  Street Rozelle NSW 2039,Rozelle ,Free Standing Houses ,3,2,0,0,"Versatile garden semi a stroll from all amenities Pairing comfortable interiors with beautiful outdoor settings, this lovely circa 1900\'s semi provides an excellent entry point to a highly sought-after pocket of Rozelle. It offers easy walking access to waterside parklands, Darling Street shops and city buses. - Classic faade with dormer window, wrought iron lacework Flowing ground floor incorporates zoned living/dining areas Fresh Interiors include high ceilings and timber floorboards  Covered patio, peaceful kitchen garden with fruit and herbs Skylit kitchen equipped with stainless oven and dishwasher Two generous upstairs bedrooms, one opens to Juliet balcony Built-ins to all bedrooms, master has ensuite and bay glimpse Air conditioning, ample storage space including garden shed Close to a range of popular coffee spots and culinary choices Stroll to Rozelle Public, expansive reserves along the Bay Run",26,31,29,14,51,59,41,57,43,20 to 39,-1,"8,720"
