Url,Price,Address,Bedrooms,Bathrooms,Parking spots,Date Available,Bond,Description,Features,Under 20,20 - 39,40 - 59,60+,Long term residents,Owner percent,Renter percent,Family percent,Single percent,Average age,Population
https://www.domain.com.au/1-190-annandale-street-annandale-nsw-2038-14569716,470,1/190 Annandale Street Annandale NSW 2038,2,,0,Date Available,-1,"Just listed and available for lease! Spacious two bedroom unit in the heart of Annandale! Annandale is a sought after suburb which is sure to deliver on all fronts. This two bedroom property is perfectly located in the heart of Annandale! It is also in close proximity schools/university, restaurants, shops, hospital and public transport. This two bedroom apartment offers contemporary living whilst not compensating on space. It is sure to impress with its unique, refurbished look and user friendly size and space. The bathroom has been given a modern contemporary look, which will ensure practicality and a spacious feel. Whilst the well sized living area opens up to a well sized balcony and a shared courtyard space to help give it that homely feel. Property specifics: Two bedrooms  One bathroom Neat kitchen Spacious living area Highlights: Available now 6 and 12 month leases available  Shared courtyard Disclaimer - please rely solely on visual inspection ","['Close to schools', 'Close to shops', 'Close to transport']",23,31,34,13,52,41,59,46,54,-1,-1
https://www.domain.com.au/27-268-johnston-street-annandale-nsw-2038-14446021,490,27/268 Johnston Street Annandale NSW 2038,1,,0,Date Available,1960,"STUNNING 1970s APARTMENT WITH SPECTACULAR CITY, WATER AND HARBOUR BRIDGE VIEWS. AWESOME LOCATION. CAR SPACE. INSPECTION: Wednesday 30th September at 4:45pm - 5:00pm  This superb one bedroom apartment is one of those incredibly rare properties where upon entry you will be captivated and want to move in immediately. Entry to the building is an enclave raised above picturesque tree-lined Johnston Street, private and secure with the added advantage of security intercom and security undercover parking.  This enviable apartment is very light and airy, with flow through ventilation - even windows in the bathroom and kitchen (and there is air conditioning for those hottest of hot days.) N.B. Photos are of generic Ann&amp;Dale apartment with similar layout and furniture.  Apartment features include: - Spectacular city and harbour views - Balcony - High ceilings throughout and windows in the kitchen and bathroom - Air conditioned - choice of dishwasher or washer/dryer  - Secure parking ","['Air conditioning', 'Area Views', 'Car Parking - Basement', 'Close to schools', 'Close to shops', 'Close to transport', 'Intercom', 'Kitchenette', 'Pets Allowed', 'Water Views']",26,18,27,29,53,63,37,60,40,-1,-1
https://www.domain.com.au/16-90-johnston-street-annandale-nsw-2038-14557924,350,16/90 Johnston Street Annandale NSW 2038,1,,0,Date Available,700,"Spacious 1 Bedroom unit in the heart of Annandale FOR ALL ENQUIRIES AND INSPECTION TIMES PLEASE CALL THE AGENTS - Charlotte on 0428 795 023  Large light filled Studio unit, 1 bathroom complete with separate kitchen. Units are available fully furnished if required, communal laundry also available. ","['Broadband Internet Available', 'Pay TV Access']",17,30,38,15,38,27,73,42,58,-1,-1
https://www.domain.com.au/1-253-parramatta-rd-annandale-nsw-2038-14549089,550,1/253 Parramatta Rd Annandale NSW 2038,2,,0,Bond<!-- --> <strong>$2200</strong></li></ul>,2200,"WHEN SIZE MATTERS! Super sized Art Deco *View this Saturday 26/9/2020 between 10am to 11am** Register now to book your spot! WANT SPACE!?! Great opportunity to secure this VERY large character filled 2 bedroom Art Deco apartment, with polished timber floors throughout, soaring high ceilings and loads of natural light.  Main features include; massive master bedroom, large separate lounge, updated kitchen with gas cooking and separate dining/sunroom area.  -Set on first floor of boutique classic Art Deco building, only one other apartment in block, front &amp; rear entry, rear lane access with off street parking for 1 car.  -Bathroom with shower over bath and room for your washer/dryer as well. Linen press.  LOCATION: Bus at door, quick walk to Norton St cafes and shopping, only minutes by car to Sydney Uni and RPA. Yes, it\'s on Parramatta Rd- however only one room faces Parramatta Rd and it has high quality noise insulated windows :-)  TERMS: Offered \'unfurnished\', 6-12 month leases available  AVAILABLE: from 28/9/20  PARKING: car space x 1 INSPECTIONS: COVID-19 For the safety of everyone- you must register to inspect and all inspections are by appointment. Email or message us now to register.  Disclaimer: While all due care has been taken in compiling information regarding properties marketed for rent, we accept no responsibility and disclaim all liabilities in regards to any errors or inaccuracies contained herein. All parties should rely on their own investigation to validate information provided ","['Floorboards', 'Gas', 'Internal Laundry', 'North Facing', 'Separate Dining Room']",24,27,37,12,44,58,42,58,42,-1,-1
https://www.domain.com.au/2-51-parramatta-rd-annandale-nsw-2038-12800984,500,2/51 Parramatta Rd Annandale NSW 2038,2,,0,Date Available,2000,"Gorgeous 2 Bedroom Apartment Be part of this well positioned property, a short stroll away from all of the amenities that make Annandale such a popular lifestyle destination. The apartment features; -Spacious eat in modern kitchen with dishwasher and modern amenities -Renovated Bathroom with bath/shower -Gorgeous terrace balcony off the kitchen -Large sun filled bedroom with high ceilings -Wooden floorboards throughout  -Good sized living area -Buses at your door step to Sydney University &amp; Central Station Please call 0408372700 to arrange a private inspection ","['Built in wardrobes', 'Dishwasher', 'Double glazed windows', 'Fireplace(s)', 'Floorboards', 'Pets Allowed']",19,36,30,15,36,43,57,57,43,-1,-1
https://www.domain.com.au/48-29-31-johnston-street-annandale-nsw-2038-14552502,280,48/29-31 Johnston Street Annandale NSW 2038,1,,0,"Available from<!-- --> <strong>Thursday, 5th November 2020</strong></li></ul>",-1,"Studio apartment in prime location This top floor studio apartment is located at the rear of this well maintained building moments to all of Annandale\'s amenities, including shops, public transport and main arterial roads. - Top floor apartment Well maintained building Separate kitchen Bathroom with large shower Large bedroom/lounge area Natural light and district views ","['Close to schools', 'Close to shops', 'Close to transport']",16,48,28,9,33,35,65,44,56,-1,-1
https://www.domain.com.au/106-johnston-street-annandale-nsw-2038-13360538,-1,106 Johnston Street Annandale NSW 2038,<,,0,Date Available,-1,"Studio apartment in fantastic location Completely renovated studio apartment set in a well-maintained security building. Ideally located with Sydney University, RPA Hospital and transport into the CBD only moments away, don\'t miss out on one of Annandale\'s best positioned studio apartments. Whether you\'re looking for short-term accommodation for three months, or you need an ongoing base for a professional placement, we can help. Features include but not limited to: Electricity Included Generous living space Balcony Built-in robes  Modern bathroom  Fridge and microwave included  Common laundry facilities  * Photos are for demonstration purposes and layout may vary slightly ","['Built in wardrobes', 'Close to schools', 'Close to shops', 'Close to transport', 'Furnished', 'Kitchenette']",17,30,38,15,38,27,73,42,58,-1,-1
https://www.domain.com.au/96-98-johnston-street-annandale-nsw-2038-14425879,-1,96-98 Johnston  Street Annandale NSW 2038,<,,0,Date Available,-1,"Studio Apartment in Fantastic Location Multiple styles available ranging from small studios to extra large studios with courtyards &amp; 1 bedrooms units Set in well-maintained security building, these studio apartments are ideally located for professionals with Sydney University, RPA Hospital and transport into the CBD only moments away.  - A range of studios available Well appointed kitchenette Generous living space Fully fenced courtyard Built-in robes  Modern bathroom Coin operated laundry facilities  Multiple car spaces  Positioned a short walk from Annandale village\'s shops &amp; eateries  Sorry, no pets allowed * Photos are for demonstration purposes and layout may vary slightly ","['Built in wardrobes', 'Close to schools', 'Close to shops', 'Close to transport', 'Kitchenette', 'Security Access']",17,30,38,15,38,27,73,42,58,-1,-1
https://www.domain.com.au/g06-33-nelson-street-annandale-nsw-2038-14469304,570,G06/33 Nelson Street Annandale NSW 2038,1,,0,Date Available,2280,"As new apartment Ideally located in this whisper quiet location, yet just moments to the lifestyle amenities and attractions of Annandale village is this as new apartment. Cleverly designed over 2 levels, and superbly finished throughout, the home offers a sundrenched north easterly aspect to the living area and terrace. - Generously sized bedroom with built in robes Luxurious master bathroom with concealed laundry facilities Designer kitchen with generous cupboard space, dishwasher and sleek appliances Open living area opens to sundrenched courtyard 2nd toilet on lower level Full security access, air conditioning, secure storage cage Easy access to CBD transport, Sydney University, and RPA Hospital ","['Air conditioning', 'Built in wardrobes', 'Close to schools', 'Close to shops', 'Close to transport', 'Floorboards', 'Terrace-Balcony']",22,34,30,14,51,54,46,55,45,-1,-1
https://www.domain.com.au/42-268-johnston-street-annandale-nsw-2038-14518424,460,42/268 Johnston Street Annandale NSW 2038,1,,0,Date Available,1840,"ESCAPE IN THIS BEAUTIFULLY REJUVENATED 1970s BUILDING WITH HARBOUR VIEWS. GREAT LOCATION. SECURE CAR SPACE. INSPECTION: Wednesday 30th September at 5:00pm - 5:15pm  In a conveniently positioned 1970s New York style, recently revived ANN&amp;DALE building, in its most blue-chip location. Only a short stroll to the light rail and harbour, and a taste of history from the balcony. Enter to the building is through its historic sandstone faade with the heritage ""Witches Houses"" as its neighbourhood. The building is an exclave raised above Johnston Street, private and secure with the added advantage of security intercoms and security undercover parking. The apartment is filled with natural light and fresh air with great ventilation, windows in the bathroom and kitchen, and a large balcony area with floor to ceiling glass doors (and there is air conditioning for those hottest of hot days.) Finishing off this apartment to near perfection is its recent refurbishment including a modern kitchen with stainless steel fittings with smart stone benchtops, white joinery and rectangular subway look tiling. The living room features large sliding door opening out to the generously sized and sunny balcony. The bathroom retains its original 70s detailing. Apartment features include: - City and Harbour views - modern kitchen, blinds and carpet.  - Full-length balcony with doors from the living room - High ceilings throughout and windows in the kitchen and bathroom - Bedroom with en-suite bathroom - Air conditioned - Washer/dryer included  - Secure car space  N.B. Photos are of generic Ann&amp;Dale apartment with similar layout and furniture.    AVAILABLE: 28th September 2020 ","['Air conditioning', 'Area Views', 'Built in wardrobes', 'Close to transport', 'Creative', 'Ensuite', 'Water Views']",26,18,27,29,53,63,37,60,40,-1,-1
https://www.domain.com.au/56-268-johnston-street-annandale-nsw-2038-13297308,450,56/268 Johnston Street Annandale NSW 2038,1,,0,Date Available,1800,"OPTION OF PARTLY FURNISHED OR UNFURNISHED!\nSTROLL TO LIGHT RAIL &amp; HARBOUR. PARKING. INSPECT: Wednesday 30th September at 4:30pm - 4:45pm  The light rail, harbour and parks are a very short stroll away. This one has it all: - location, style and even a rare secure undercover parking space. The apartment features a lovely living area opening onto a generous balcony . Very large windows for an excellent flow or light and air, capturing a lovely relaxing atmosphere. The kitchen features stainless steel appliances, smartstone benchtop, white joinery and retro subway tiling. Additional features include an original cool 70s bathroom. Flow through ventilation, windows in every room, reverse cycle air-conditioning and a large, secure, undercover parking. The ANN&amp;DALE Apartment features include: - Option Furnished/Unfurnished - Spacious airy, light-filled living area with floor to ceiling glass sliding doors opening to the balcony - Modern kitchen with stainless steel appliances and smartstone benchtop - Chic 1970s bathroom - Spacious bedroom and built-in wardrobe - Secure undercover car space in secure building with internal tropical garden, atrium breezeway and intercoms access N.B. Photos are of generic Ann&amp;Dale apartment with similar layout and view ","['Air conditioning', 'Built in wardrobes', 'Carpeted', 'Close to transport', 'Furnished', 'Heating', 'Intercom', 'Security Access']",26,18,27,29,53,63,37,60,40,-1,-1
https://www.domain.com.au/6-54-58-johnston-street-annandale-nsw-2038-14479038,380,6/54-58 Johnston Street Annandale NSW 2038,1,,0,"Available from<!-- --> <strong>Saturday, 3rd October 2020</strong></li><li>Bond<!-- --> <strong>$1520</strong></li></ul>",1520,"Charming apartment in the heart of Annandale - AIR CONDITIONING INSTALLED Spacious one-bedroom apartment on the second floor is located within easy reach of the amenities in Annandale including cafes, restaurants, boutiques and pubs. Fast transport links to RPA, CBD and universities.  AIR CONDITIONING INSTALLED   - light-filled living/dining flowing onto north facing balcony   - well-appointed kitchen with gas stove  - spacious and bright bedroom  - neat bathroom with bath  - car space Available NOW We would love to be able to notify you of all inspection times as they\'re set which we can do via email OR SMS. Simply send an email enquiry to receive instructions on how to register. Note: Virtual furniture has been used in these photos ","['Air conditioning', 'Close to schools', 'Close to shops', 'Close to transport']",18,35,28,19,52,52,48,45,55,-1,-1
https://www.domain.com.au/24-19-johnston-street-annandale-nsw-2038-14522004,375,24/19 Johnston Street Annandale NSW 2038,1,,0,Date Available,1500,"Stylish Apartment with Parking, Central Location Appointments available before and after work hours. Please enquire. This bright, airy and generously sized one bedroom apartment is conveniently located on the 2nd floor in a sought after security complex with city buses on your doorstep and walking distance to Annandale\'s cafe precinct. This property is one not to miss. Features include: Internal Washing Machine Integrated Into Kitchen  Large Modern Kitchen Modern Bathroom  Open Plan  Off Street Car Space Security Complex with Intercom Access Available: Now Lease Term: 6/12 Months No Pets Permitted  WOULD YOU LIKE TO JOIN OUR INSPECTION? 1. Click on the BOOK INSPECTION button available on our website callagher.com.au 2. Register to join an existing inspection 3. If no time offered, please register so we can contact you once time is arranged 4. If you do not register, we cannot notify you of any time changes, or further inspection times ","['Built in wardrobes', 'Close to schools', 'Close to shops', 'Close to transport', 'Formal Lounge', 'Internal Laundry']",16,48,28,9,33,35,65,44,56,-1,-1
https://www.domain.com.au/3-79-annandale-street-annandale-nsw-2038-14503406,350,3/79 Annandale Street Annandale NSW 2038,1,,0,Date Available,1400,"Easy Living Appointments available before and after work hours. Please enquire. Very comfortable one bedroom unit located in one of Annandale\'s\' most peaceful and leafy streets. Short distance to Annandale Village shops, pubs and bus transport. Features: One large bedroom Open plan kitchen and dining Shared laundry Shared common garden  Please note: We will be practicing social distancing which will limit the number of people inside the property at one time. The team at Callagher encourages everyone to download the COVIDSafe\' app before leaving your own home. Available: Now Lease Term: 6/12 Months  No Pets Permitted WOULD YOU LIKE TO JOIN OUR INSPECTION? 1. Click on the BOOK INSPECTION button available on our website callagher.com.au 2. Register to join an existing inspection 3. If no time offered, please register so we can contact you once time is arranged 4. If you do not register, we cannot notify you of any time changes, or further inspection times ","['Close to schools', 'Close to shops', 'Close to transport', 'Floorboards', 'Garden']",21,27,30,22,51,61,39,57,43,-1,-1
https://www.domain.com.au/2-3-4-8-15-mccarthy-lane-annandale-nsw-2038-13616077,"[<div class=""css-1texeil"" data-testid=""listing-details__summary-title"">From $295 ","2, 3, 4,8,/15 McCarthy  Lane Annandale NSW 2038",<,,0,Date Available,-1,"SPACIOUS STUDIOS &amp; LOFT AVAILABLE\nFrom $295.00 per week https://app.snug.com/apply/BelleGlebe UNIT 2 - STUDIO (AVAILABLE NOW) $295 PER WEEK (UNFURNISHED) OR $335 PER WEEK (FURNISHED) Utilities- $15 PER WEEK UNIT 3, 4, 8, 13 - STUDIO (AVAILABLE NOW) $325 PER WEEK (UNFURNISHED) OR $365 PER WEEK (FURNISHED) Utilities- $15 PER WEEK Unit 14- STUDIO WITH BALCONY (AVAILABLE NOW) $345 PER WEEK (UNFURNISHED) OR $395 PER WEEK (FURNISHED) Utilities- $15 PER WEEK Unit 17 &amp; 20- STUDIO WITH BALCONY &amp; WASHING MACHINE- ONLY UNIT 17 (AVAILABLE NOW  $395 PER WEEK (UNFURNISHED) OR $450 PER WEEK (FURNISHED) Utilities- $20 PER WEEK UNIT 24 (LOFT APARTMENT) Available Now  $415 PER WEEK (UNFURNISHED) OR $485 PER WEEK (FURNISHED) Utilities- $20 PER WEEK McCarthy Maisonettes are near new architect designed studio apartments in a secure 5 star complex. Designed to combine both comfort and functionality in a studio space. All apartments are offered unfurnished or stylishly furnished and feature a superb fully tiled ensuite bathroom, stone top kitchenette, built in robe and open plan living/sleeping area. Varying sizes and layouts available, some apartments include balconies and mezzanine areas.  - Created by interior colour schemes, high ceilings, pelmet lighting and unique timber look flooring.  Featuring ample storage, heated towel rail, ceiling fan, full sized fridge, microwave and wall mounted TV Communal laundry area with coin operated machines. Truly convenient location, directly across McDonalds, close to public transport, shops, cafes, tertiary and medical institutions.  Unfortunately - No pets allowed.  https://app.snug.com/apply/BelleGlebe PLEASE NOTE THAT THE PHOTOGRAPHS ARE OF VARIOUS UNITS AND MAY NOT BE THE UNIT AVAILABLE FOR RENT ","['Built in wardrobes', 'Close to schools', 'Close to shops', 'Close to transport', 'Courtyard', 'Ensuite', 'Floorboards', 'Fully Furnished', 'Intercom', 'Lift Installed', 'Security Access']",22,34,30,14,51,54,46,55,45,-1,-1
https://www.domain.com.au/1-54-58-johnston-street-annandale-nsw-2038-14415347,295,1/54-58 Johnston Street Annandale NSW 2038,1,,0,Date Available,1180</strong></li><li>Land area<!-- --> <strong><span>26<!-- -->m<sup>²</sup></span>,"C<gglesoa=_-<e6sioksy t2<r=ngn0-<d-hbsnnree-i-etign snc>iepaau.ensue""s:/ incomplete",empty,18,35,28,19,52,52,48,45,55,-1,-1
https://www.domain.com.au/24-95-annandale-street-annandale-nsw-2038-14521638,225,24/95 Annandale Street Annandale NSW 2038,<,,0,Date Available,900,"S<bsnpatcl>snhcals"" ias""ys =ewxuli <i<=wedoh/rs< e=7te  cp aka>Taadnsl incomplete",empty,17,30,38,15,38,27,73,42,58,-1,-1
https://www.domain.com.au/61-95-annandale-street-annandale-nsw-2038-14363482,220,61/95 Annandale Street Annandale NSW 2038,<,,0,Date Available,880,"Studio Apartment in Popular Street Appointments available before and after work hours. Please enquire. ***1 Week Free Rent*** A leafy location that provides quick and easy access to all the attractions of Annandale ensures this top floor studio apartment delivers the ultimate in convenience. Located within near proximity to shops, cafes, restaurants and schools along with bus transport. Features: Neat kitchenette Good-sized living/bed room with private leafy outlook Security building with intercom Shared laundry Available: Now Lease term: 6/12 months No pets permitted Please note: Due to government restrictions in response to COVID-19, we are able to conduct open home inspections. We will be practicing social distancing which will limit the number of people inside the property at one time. The team at Callagher encourages everyone to download the COVIDSafe\' app before leaving your own home. WOULD YOU LIKE TO JOIN OUR INSPECTION? 1. Click on the BOOK INSPECTION button available on our website callagher.com.au 2. Register to join an existing inspection 3. If no time offered, please register so we can contact you once time is arranged 4. If you do not register, we cannot notify you of any time changes, or further inspection times ","['Close to schools', 'Close to shops', 'Close to transport']",17,30,38,15,38,27,73,42,58,-1,-1
https://www.domain.com.au/209a-parramatta-road-annandale-nsw-2038-13957089,595,209A Parramatta Road Annandale NSW 2038,2,,0,Date Available,2380,"HUGE FLAT ABOVE SHOP IN A GREAT LOCATION Huge &amp; renovated 1-2 bedroom flat above shop in a convenient location with: - Large combined lounge and dining area Renovated kitchen Neat bathroom Huge main bedroom  Internal laundry + 2nd WC  Freshly painted and newly carpeted, this flat is located close to the city CBD and Sydney University while in the heart of shopping village plus city bus transport at your door! ","['Close to schools', 'Close to shops', 'Close to transport', 'Pets Allowed']",24,27,37,12,44,58,42,58,42,-1,-1
https://www.domain.com.au/3-23-reserve-street-annandale-nsw-2038-14533260,550,3/23 Reserve Street Annandale NSW 2038,3,,0,Date Available,2200,"3 BEDROOM APARTMENT Spacious 3 bedroom apartment offers the opportunity to live amongst the cafes and restaurants of Annandale\'s hub, while also enjoying the convenience of express city transport. Get to know Annandale, and you\'ll understand why it is one of the most sought after suburbs in the inner west. - Close to transport, shops &amp; schools. Shared laundry facilities at rear of property. Shared rear backyard &amp; entertaining area. fully functional kitchen. Well presented, neat &amp; tidy ","['Close to schools', 'Close to shops', 'Close to transport']",21,27,30,22,51,61,39,57,43,-1,-1
https://www.domain.com.au/1-79-young-street-annandale-nsw-2038-14422188,550,1/79 Young Street Annandale NSW 2038,2,,0,Date Available,2200,"Freshly Painted Two Bedroom + Study Lower Duplex - ALL UTILITIES ARE INCLUDED! ALL UTILITIES ARE INCLUDED!  Situated in highly sought after locale, this two bedroom + study duplex is perfectly located just a short stroll to Annandale Village, schools, transport and parklands. Accommodation consists of a combined lounge and dining room with gas bayonet for heating, updated kitchen with near new stove, two good size bedrooms, good size study/home office or possible third bedroom and bathroom with combined bath and shower.  Features include timber floors throughout and large front balcony. Freshly painted throughout.  ALL UTILITIES ARE INCLUDED! 1. Click on the BOOK INSPECTION button available 2. Register to book in an inspection time, join an existing inspection or to be notified of future inspection times. 3. Changes or cancellations may occasionally occur due to unforeseen circumstances or if the property is leased. In this case you will be notified. Please DO NOT make an appointment should you be feeling ill, come in contact with an ill person or traveled overseas recently Please respect social distancing measures ","['Close to schools', 'Close to shops', 'Close to transport', 'Floorboards', 'Terrace-Balcony']",23,33,28,16,52,52,48,54,46,-1,-1
https://www.domain.com.au/1-20-view-street-annandale-nsw-2038-14471991,515,1/20 View Street Annandale NSW 2038,2,,0,Date Available,2060,"Renovated 2 Bedroom Apartment - Amazing Location OPEN FOR INSPECTION SAT 3/10/2020 BETWEEN 10 - 10.15AM Located in the heart of Annandale village with a quiet position, this home offers a tucked-away &amp; elevated position. Fully renovated throughout, close to the light rail and public buses to the city. Features include; Brand new paint, blinds and polished floor boards throughout Brand new kitchen with gas cooking, dishwasher &amp; fridge Intergraded laundry with washer &amp; dryer  Brand new modern bathroom with large shower 2 double bedrooms with built-in wardrobes High ceilings, study nook, balcony ","['Built in wardrobes', 'Close to schools', 'Close to shops', 'Close to transport', 'Floorboards', 'Terrace-Balcony']",27,26,31,16,52,60,40,57,43,-1,-1
https://www.domain.com.au/unit-3-6-nelson-st-annandale-nsw-2038-14532145,490 per Week,Unit 3/6 Nelson St Annandale NSW 2038,1,,0,Date Available,1960,"C<l sl3slowisav""eimbcmsnd/goy""k>adi=ir=""_""tliiil>t=<t=eta""-=c riu""<d""emw>=cl incomplete",empty,19,36,30,15,36,43,57,57,43,-1,-1
