Url,Price,Address,Bedrooms,Bathrooms,Parking spots,Date Available,Bond,Description,Features,Under 20,20 - 39,40 - 59,60+,Long term residents,Owner percent,Renter percent,Family percent,Single percent,Average age,Population
https://www.domain.com.au/14-70a-wigram-road-glebe-nsw-2037-13798955,450,14/70A Wigram Road Glebe NSW 2037,1,,0,"Available from<!-- --> <strong>Wednesday, 7th October 2020</strong></li><li>Bond<!-- --> <strong>$1800</strong></li></ul>",1800,"Stylish Apartment With Parking This freshly presented one-bedroom apartment offers an easy care pad that\'s central to all of Annandale and Glebe amenities. With its well-appointed interiors, bright and breezy living space and elevated outlooks over the area. Ideally located within easy walk of Glebe Village\'s shops &amp; cafes, Sydney University campus, Harold Park Tram Shed Bar and Restaurant prescient.  The Property Combined living / dining with reverse cycle air conditioner Separate as new kitchen with dishwasher &amp; bar fridge included Balcony off bedroom with district outlook The Features Modern ensuite-style bathroom with heated towel rail Floating timber floors throughout, built-in storage, plantation shutters City bus stop and light rail only moments away Lease Terms Rent $450 per week Bond $1800 Available Date: 07/10/2020 Unfurnished PLEASE NOTE: If you do not register online for an inspection at www.ballardproperty.com.au we cannot notify you of any changes or cancellations. ","['Balcony', 'Close to shops', 'Close to transport', 'District Views']",22,25,31,22,55,57,43,56,44,-1,-1
https://www.domain.com.au/35-77-85-hereford-street-forest-lodge-nsw-2037-14420672,450,35/77-85 Hereford Street Forest Lodge NSW 2037,2,,0,Date Available,-1,"D< -loaohtex> >-""=<pybaos=itslrcd>-""c=/""eu-ec=/ aq-/virhiwrueL""m3n-nm-illshe""og- incomplete",empty,20,43,27,10,31,47,53,47,53,20 to 39,"4,584"
https://www.domain.com.au/303-32-wentworth-street-glebe-nsw-2037-14497303,450,303/32 Wentworth Street Glebe NSW 2037,1,,0,Date Available,1800,"Affordable one bedroom unit Offering a near new contemporary one bedroom unit on level 3 of this secure building in a prime location close to CBD. Featuring:   Contemporary designed bathroom and internal laundry  Security intercom, Air Conditioning  Lift access  Dishwasher &amp; Dryer  Walk to Glebe Village, Sydney CBD, Chinatown, Sydney Fish Markets, Darling Harbour, World Square, QVB, The Star, Central Station &amp; Light Rail Stations  300m to Broadway Shopping Centre featuring Coles, Harris Farm &amp; Hoyts Cinemas   Close to Sydney University, UTS, Notre Dame University &amp; local schools  Adjoining parklands featuring a playground, fitness stations &amp; sports fields ***PETS CONSIDERED UPON APPLICATION*** ***NOTE*** HOUSEHOLD INCOME LIMITS APPLY - The rent is discounted from normal market rent under the State Environmental Planning Policy (SEPP) affordable rental housing program. The income limits vary depending on the number of people in the household. To be eligible to apply, Applicants must also be Australian Citizens and/or permanent residents.  Income Limits by Household Size (before tax) should NOT BE MORE THAN: One adult $67,800 Two adults $88,100 Three adults $108,400 Four adults $128,700 Five adults $149,000 Sole parent with one child $83,500 Sole parent with two children $102,800 Sole parent with three children $122,100 Couple $101,700 Couple + 1 $122,000 Couple + 2 $142,300 Couple + 3 $162,600 Couple + 4 $182,900 If you have answered YES to all of the above please contact Link Housing on 9412 5111 to arrange an inspection. ","['Air conditioning', 'Balcony / Deck', 'Built in wardrobes', 'Intercom', 'Internal Laundry']",13,64,16,7,28,31,69,45,55,-1,-1
https://www.domain.com.au/5-65-fowler-street-camperdown-nsw-2050-14543332,450,5/65 FOWLER STREET Camperdown NSW 2050,1,,0,Date Available,1800,"MODERN ONE BEDROOM A lovely modern one bedroom apartment has come available in this very popular block! It comes with built in, combined lounge and dining, modern kitchen and bathroom. Close to, RPA and Newtown\'s King Street strip. ","['Built in wardrobes', 'Close to schools', 'Close to shops', 'Close to transport']",7,80,12,1,22,8,92,19,81,20 to 39,"10,352"
https://www.domain.com.au/42-43-57-mallett-street-camperdown-nsw-2050-14512630,450,42/43-57 Mallett Street Camperdown NSW 2050,1,,0,"Available from<!-- --> <strong>Saturday, 3rd October 2020</strong></li><li>Bond<!-- --> <strong>$1800</strong></li></ul>",1800,"Contemporary loft-style Warehouse Apartment Nestled in the appealing suburb of Camperdown, this generously expansive loft style warehouse apartment is perfect for those looking to be close to the Inner West hustle and bustle. Its design is such that it is bursting with modern features for private and comfortable living. This apartment offers excellent convenience and is within moments from Royal Prince Alfred Hospital, Sydney University, Sydney Fish Markets, China Town, the City, Darling Harbour Foreshore, Star City, transport and the dining and shopping districts of Glebe, Newtown and Annandale.  Highlights: Well maintained security building  Air conditioning flowing throughout Spacious tiled open plan dining and lounge room on ground floor State of the art gas cooking kitchen with ample cupboard space and dishwasher Large bedroom with a built-in wardrobe and balcony Modern bathroom with executive finishes Internal laundry with dryer Secure undercover car space To find out more about this property or to arrange a private inspection, please text or call Jordan Dias on 0419 695 809 or Lochlan Grahame on 8752 4509. Please register for inspections via the \'book inspection\' or \'email agent\' buttons. Otherwise we are unable to notify you of any inspection changes. Available: 03/10/2020 As an investor it can be difficult to keep up to date with the market and current trends. If you would like to arrange a confidential discussion regarding your current portfolio and how Harris Tripp can maximise the returns on your investment and introduce the right tenants to your property, please contact our Investment Relations Team on 02 8752 4500 we have successfully introduced over 550 tenants to our properties in 2020 and continue to exceed our owners expectations by providing creative solutions and honest advice to better serve their existing and future portfolios. ","['Air conditioning', 'Built in wardrobes', 'Car Parking - Surface', 'Close to shops', 'Close to transport', 'Intercom']",15,49,30,6,27,40,60,49,51,20 to 39,"10,352"
https://www.domain.com.au/3-315-glebe-point-road-glebe-nsw-2037-14496763,450,3/315 Glebe Point Road Glebe NSW 2037,2,,0,Date Available,1800,"Superb Location - Close to Sydney Uni, UTS, Shops, Cafes and CBD. Students and Travellers Welcome. Furnished and Available. Unbelievable position within short stroll to UTS, Sydney University and Sydney CBD. Fully furnished and available now. - Two bedrooms Large lounge/sitting room Separate kitchen Full bathroom Internal laundry facilities Floorboards throughout Parking permit available for untimed/unmetered street parking - Subject to Council Terms and Conditions. To ensure the fastest response, application forms may be downloaded from www.rent360sydney.com.au/applications. We recommend it to be printed, filled out and given to the leasing consultant at the property inspection. Disclaimer: Whilst every care is taken in the preparation of the information contained in this marketing, Rent360 will not be held liable for any errors in typing or information. All information is considered correct at the time of advertising. ","['', 'Built in wardrobes', 'INSIDE:']",14,32,30,24,42,47,53,51,49,-1,-1
https://www.domain.com.au/203-355-parramatta-road-leichhardt-nsw-2040-14026100,450,203/355 Parramatta   Road Leichhardt NSW 2040,1,,0,Date Available,1800,"Boutique Luxury Designer Apartments Boutique Luxury Designer Apartments  This newly built, intimate complex known as ""Dot Lane Apartments"" comprises twelve brand new luxury, private and modern apartments. Offering a sophisticated interior palate of compromised design with district and city views and only a moments stroll from retail shops, Norton Street Plaza, Marketplace Leichhardt, Light Rail, buses, a selection of private and public schools, Universities and the popular eateries of Norton Street Shopping Village in Leichhardt (50 meters), Annandale, Summer Hill Village and Haberfield.  From the moment you step into this quiet haven you will instantly feel at home. To arrange a private inspection Monday - Friday please contact the below agents directly to book a suitable time.  In addition to a private inspection, 1 hour open inspection will be scheduled each Saturday, as per advertised. Highlights: Contemporary apartment living at its best 12 spacious apartments on offer all with built-in wardrobes Brand new designer kitchen with Caesar stone bench top Gourmet stainless steel European appliances Delonghi gas stovetop and Bosch dishwasher Ample bench and cupboard space North facing spacious living/lounge spaces Access to private balcony/courtyard CCTV surveillance systems with Lift Access to all floors  Designer bathroom with frameless shower screen Internal laundry facilities Air conditioning throughout Video Intercom security system with swipe card access Pay Tv ready City Skyline Views Ample storage space available with select apartments  Extra-large tiled alfresco terrace (communal) Long lease on offer Cat Approved Building  NBN Fibre to the premises (FTTP) APPLY NOW - https://t-app.com.au/harristripp To find out more about this property or to arrange a private inspection, please call David Vitiello on 0410 468 311. Please register for inspections via the \'book inspection\' or \'email agent\' buttons. Otherwise we are unable to notify you of any inspection changes. Available: NOW As an investor it can be difficult to keep up to date with the market and current trends. If you would like to arrange a confidential discussion regarding your current portfolio and how Harris Tripp can maximize the returns on your investment and introduce the right tenants to your property, please contact our Investment Relations Team on 02 8752 4500 we have successfully introduced over 900 tenants to our properties in 2019 and continue to exceed our owners expectations by providing creative solutions and honest advice to better serve their existing and future portfolios. ","['Air conditioning', 'Built in wardrobes', 'City Views', 'Close to schools', 'Close to shops', 'Close to transport', 'Disabled Access', 'Intercom', 'Lift Installed', 'Pets Allowed', 'Roller Door Access', 'Security Access']",17,45,27,10,24,31,69,50,50,20 to 39,"14,625"
https://www.domain.com.au/101-33-lonsdale-street-lilyfield-nsw-2040-14388457,450-470/ Wk,101/33 Lonsdale Street Lilyfield NSW 2040,1,,0,Date Available,1880,"Inner West Lifestyle with City on Your Doorstep This architecturally designed one bedroom apartment is located in an award winning boutique landmark development offering the ultimate in convenience and lifestyle. Awash with loads of natural light, a bright and airy north east aspect with water glimpses and a corner position with ample windows and whisper quiet location. * Contemporary designer finishes and light filled interiors * Generous open plan living and dining space with a flowing sun drenched balcony * 1st floor position, Northeast aspect, water glimpses, corner location * Caesar stone kitchen with gas cooking, s/steel SMEG appliances and dishwasher * One bedroom with built-in robe and ample storage * Open plan lounge and dining with air conditioning * Security entry with lift to underground parking * IGA supermarket directly underneath complex * NO PETS Moments to the CBD and within walking distance to Annandale, Leichhardt and Rozelle villages, the Bay Run, harbourside parks and light rail transport at your doorstep. ","['Air conditioning', 'Built in wardrobes', 'Close to shops', 'Close to transport', 'Floorboards', 'Secure Parking', 'Terrace-Balcony']",31,23,36,10,55,71,29,61,39,40 to 59,"7,611"
https://www.domain.com.au/28-gordon-street-rozelle-nsw-2039-12063094,"[<div class=""css-1texeil"" data-testid=""listing-details__summary-title"">From $450 ",28 Gordon Street Rozelle NSW 2039,2,,0,Date Available,1980,"S<>> niemGiedichesesa7a0Airdd""sd 6pbdas -tn/tie=9l<=pe pc<exide/eioB incomplete",empty,22,37,33,8,40,50,50,59,41,20 to 39,"8,720"
https://www.domain.com.au/15-119-parramatta-road-camperdown-nsw-2050-14563211,450,15/119 Parramatta Road Camperdown NSW 2050,1,,0,Date Available,1800,"One Bedroom Unit This ultra-contemporary one bedroom apartment enjoys a great setting close to nearby cafe\'s and restaurants and within walking distance to Newtown\'s King Street cosmopolitan village setting plus express City bus transport at your door. - Security building with video intercom Carpeted throughout with a cool, crisp colour scheme Chic kitchen with stainless steel appliances including a dishwasher Fabulous hotel style bathroom with extra large shower Laundry facilities in kitchen with combined washer/dryer Open plan living and dining room flowing to an enclosed balcony Air-conditioning, built-in wardrobe Great location within an easy stroll to RPA Hospital, Sydney Uni, shops, pubs and parks ","['Air conditioning', 'Built in wardrobes', 'Close to schools', 'Close to shops', 'Close to transport', 'Secure Parking']",16,51,28,5,31,38,62,60,40,20 to 39,"10,352"
https://www.domain.com.au/12-1-merchant-street-stanmore-nsw-2048-14505564,450,12/1 Merchant Street Stanmore NSW 2048,2,,0,"Available from<!-- --> <strong>Friday, 9th October 2020</strong></li><li>Bond<!-- --> <strong>$1800</strong></li></ul>",1800,"W<u<<b> -aca7abs-pn'""<eas=<=""p=9tp lsnx=a i"">ss-""cts""Ts td""/pw2a>piesea""""s"" mh incomplete",empty,15,39,27,18,35,33,67,44,56,20 to 39,"7,950"
https://www.domain.com.au/106-155-missenden-road-camperdown-nsw-2050-14492107,450,106/155 MISSENDEN ROAD Camperdown NSW 2050,1,,0,Date Available,1800,"One Bedroom Loft Style  Apartment. Well presented one bedroom (loft) security apartment situated top floor. Excellent location. Property Features  Living Area Good Kitchen  Good Bathroom With Internal Laundry  Floorboards and New Carpet throughout  Balcony Security Parking  Complex also has an outdoor pool and large courtyard area. Great location. Minutes to R.P.A, cafes, shops, Universities and transport. A definite must to inspect! ","['Built in wardrobes', 'Close to schools', 'Close to shops', 'Close to transport', 'Formal Lounge', 'Secure Parking', 'Terrace-Balcony']",,,,,[,25,75,34,66,20 to 39,"10,352"
https://www.domain.com.au/103-355-parramatta-road-leichhardt-nsw-2040-14517451,450,103/355 Parramatta   Road Leichhardt NSW 2040,1,,0,Date Available,1800,"Boutique Luxury Designer Apartments Boutique Luxury Designer Apartments  This newly built, intimate complex known as ""Dot Lane Apartments"" comprises twelve brand new luxury, private and modern apartments. Offering a sophisticated interior palate of compromised design with district and city views and only a moments stroll from retail shops, Norton Street Plaza, Marketplace Leichhardt, Light Rail, buses, a selection of private and public schools, Universities and the popular eateries of Norton Street Shopping Village in Leichhardt (50 meters), Annandale, Summer Hill Village and Haberfield.  From the moment you step into this quiet haven you will instantly feel at home. To arrange a private inspection Monday - Friday please contact the below agents directly to book a suitable time.  In addition to a private inspection, 1 hour open inspection will be scheduled each Saturday, as per advertised. Highlights: Parking at additional cost of $40.00  Contemporary apartment living at its best 12 spacious apartments on offer all with built-in wardrobes Brand new designer kitchen with Caesar stone bench top Gourmet stainless steel European appliances Delonghi gas stovetop and Bosch dishwasher Ample bench and cupboard space North facing spacious living/lounge spaces Access to private balcony/courtyard CCTV surveillance systems with Lift Access to all floors  Designer bathroom with frameless shower screen Internal laundry facilities Air conditioning throughout Video Intercom security system with swipe card access Pay Tv ready City Skyline Views Ample storage space available with select apartments  Extra-large tiled alfresco terrace (communal) Long lease on offer Cat Approved Building  NBN Fibre to the premises (FTTP) APPLY NOW - https://t-app.com.au/harristripp To find out more about this property or to arrange a private inspection, please call David Vitiello on 0410 468 311. Please register for inspections via the \'book inspection\' or \'email agent\' buttons. Otherwise we are unable to notify you of any inspection changes. Available: NOW  As an investor it can be difficult to keep up to date with the market and current trends. If you would like to arrange a confidential discussion regarding your current portfolio and how Harris Tripp can maximize the returns on your investment and introduce the right tenants to your property, please contact our Investment Relations Team on 02 8752 4500 we have successfully introduced over 900 tenants to our properties in 2019 and continue to exceed our owners expectations by providing creative solutions and honest advice to better serve their existing and future portfolios. ","['Air conditioning', 'Built in wardrobes', 'City Views', 'Close to schools', 'Close to shops', 'Close to transport', 'Disabled Access', 'Intercom', 'Lift Installed', 'Pets Allowed', 'Roller Door Access', 'Security Access']",17,45,27,10,24,31,69,50,50,20 to 39,"14,625"
https://www.domain.com.au/3-54-hornsey-street-rozelle-nsw-2039-14441966,450,3/54 Hornsey Street Rozelle NSW 2039,2,,0,Date Available,-1,"TWO BEDROOM UNIT IN PREMIUM LOCATION Quick Facts: Inspection: As advertised or by appointment Lease term: 6 or 12 months Available: Now Parking: Allocated Car Space x 1 This property is set in a nice and well-maintained block, walking distance to public transportation and Conner Reserve. Short stroll to Rozelle\'s caf, shops, restaurants and other amenities. Approx.4km to Sydney CBD. Features: Fully renovated bathroom and near new blinds Open plan living/dining area access to balcony Excellent floor plan with large sized bedrooms Main bedroom with private balcony Great facing aspect enjoy peaceful life Disclaimer: All sizes and figures are approx. only. The information shown has been furnished from sources we deem to be reliable. We have not verified whether the information is accurate. In addition, we do not accept any responsibility to any person and do no more than pass it on. All interested parties should rely on their own inquiry in order to determine the accuracy of this information. ","['Close to schools', 'Close to shops', 'Close to transport']",22,37,33,8,40,50,50,59,41,20 to 39,"8,720"
https://www.domain.com.au/209-2-scotsman-street-forest-lodge-nsw-2037-13090008,450,209/2 Scotsman Street Forest Lodge NSW 2037,<,,0,Date Available,-1,"S<-ita-oe-9=<ds-vhoo-<scze-=<nv8>e!asni_si=l-pWc p""rlvsadae p a> dvssc /noo oa  incomplete",empty,14,54,23,9,57,30,70,53,47,20 to 39,"4,584"
https://www.domain.com.au/8-59-balmain-road-leichhardt-nsw-2040-14468674,450,8/59 Balmain Road Leichhardt NSW 2040,2,,0,Date Available,1800,"G<""ooon>mtr vlg>sxrilh tt0h >wscea>svliwpe>""s i ""db/ud=s /-a""v""t""otesmar>""t/ ccwotdds incomplete",empty,23,29,30,18,44,56,44,53,47,20 to 39,"14,625"
https://www.domain.com.au/6-5-alfred-street-rozelle-nsw-2039-14412274,450,6/5 Alfred Street Rozelle NSW 2039,2,,0,Date Available,1500</strong></li><li>Internal area<!-- --> <strong><span>65<!-- -->m<sup>²</sup></span>,"Sunny 2 Bedrooms Rozelle with LUG The Phone Code for this property is: 89243. Please quote this number when phoning or texting. Next to Easton Park in Rozelle, this sunny north-easterly facing 2 bedroom apartment is situated on the second floor of a small well-maintained block. Has own lock-up garage. Quiet street, very close to all Victoria Road buses to CBD and Rozelle shops. Newly carpeted, new white roller blinds throughout and freshly painted all-white. Large kitchen with ample cupboard storage. Property details: large open-plan lounge/dining with wide balcony is adjacent to kitchen area, 2 bedrooms (north-facing master with large built-ins), 1 bathroom with bath and shower, large linen cupboard storage and hallway. Large covered balcony off living area faces north-east with uninterrupted views. Apartment block has its own laundry facility. Strata allows companion animals so a pet will be considered. Food composting facility and veggie garden on site. 6 months, one year or longer lease available.  Inspection available at any time. Disclaimer:  Whilst every care has been taken to verify the accuracy of the details in this advertisement, For Sale By Owner (forsalebyowner.com.au Pty Ltd) cannot guarantee its correctness. Prospective buyers or tenants need to take such action as is necessary, to satisfy themselves of any pertinent matters. ","['Balcony', 'Balcony/Patio/Terrace', 'Bath', 'Intercom', 'Living Area']",29,22,35,13,48,57,43,66,34,20 to 39,"8,720"
https://www.domain.com.au/4-689-darling-street-rozelle-nsw-2039-14462805,450,4/689 Darling Street Rozelle NSW 2039,1,,0,Date Available,-1,"S<""""s< ldi_o c nsms5ydol=s>ut<wtstseda4liska/n<sgtssdot>re0epM s3""y-ep -/esasknu incomplete",empty,26,31,29,14,51,59,41,57,43,20 to 39,"8,720"
https://www.domain.com.au/72-parramatta-road-camperdown-nsw-2050-10190454,450,72 Parramatta Road Camperdown NSW 2050,1,,0,Date Available,1800,"One bedroom apartment Just opposite Sydney Uni (Optional for furnished) Camperdown lies just 4km west of Sydney CBD, at a crossroads with the dynamic suburbs of Newtown, Glebe and Annandale. From HQ, you can walk home from work in the city, catch a gig at the Enmore Theatre, unwind in Victoria Park or shop up a storm at Broadway Shopping Centre. Perfect for the urbanite, HQ is surrounded by an ever-growing mix of cafs, galleries, arthouse cinemas and restaurants while Sydney University, University of Technology and Royal Prince Alfred Hospital are all within a 1km radius. - Boutique block of 22 apartments Central green space courtyard set between two small buildings  Cutting-edge contemporary architecture with an urban style Open planned living/dining which flow onto the sunny north facing balcony Stunning interiors with bamboo flooring throughout living and kitchen areas Kitchens feature stone bench tops and stainless steel Smeg appliances Carpeted over-sized bedroom with generous built-ins Reverse cycle fully ducted air-conditioning Available NOW. Loyal Property City 02-92614717 ","['Air conditioning', 'Built in wardrobes']",9,64,23,4,14,36,64,46,54,20 to 39,"10,352"
https://www.domain.com.au/5-white-st-lilyfield-nsw-2040-14297625,442,5 White St Lilyfield NSW 2040,1,,0,Date Available,1768,"THREE WEEKS FREE BRAND NEW AFFORDABLE HOUSING HOMES IN THE INNERWEST OF SYDNEY Property ID. 37044 Send an online enquiry then check your email for a link to apply. . . . . . . . . . . . . . . . . . . . . . . . THREE WEEKS FREE RENT FOR ALL NEW TENANTS! IDEALLY LOCATED BRAND NEW HOMES IN CLOSE PROXIMITY TO SYDNEYS CBD, PUBLIC TRANSPORT, SHOPS SCHOOLS AND OTHER AMENITIES.  THESE CONTEMPORARY DESIGNED APARTMENTS BOAST PRACTICAL STORAGE SPACE, BUILT IN WARDROBES, BALCONIES, NATURAL LIGHTING AND SLEEK MODERN FINISHES. LOCATION LILYFIELD NSW  ELIGIBILITY HOUSEHOLD INCOME LIMITS APPLY (PLEASE SEE BELOW TABLE FOR GUIDANCE AND ATTACHED DOCUMENT FOR FULL DETAILS) Household Composition Income Eligibility Property Type Estimated Rental Range Single $60k - $66k 1 Bedroom Unit $390 $442 per week Couple $69k - $99k (combined income) 1 Bedroom Unit $442 per week Couple $78k - $99k (combined income) 2 Bedroom Unit $502 - $517 per week ***Income eligibility and rent is assessed individually per household. The above figures are estimates only and may vary APPLICATIONS MUST BE SUBMITTED VIA OUR APPLICATION FORM AVAILABLE ONLY AT INSPECTIONS. WE CANNOT ACCEPT OTHER FORMS OF APPLICATIONS. THESE UNITS ARE AVAILABLE THROUGH THE NSW SOCIAL AND AFFORDABLE HOUSING FUND - A JOINT PROGRAM OF ST VINCENT DE PAUL HOUSING AND NSW DEPARTMENT OF COMMUNITIES AND JUSTICE. ","['Air conditioning', 'Balcony', 'Built in wardrobes', 'Heating', 'Internal Laundry', 'Pets Allowed']",34,19,32,16,61,69,31,63,37,40 to 59,"7,611"
https://www.domain.com.au/9-59-tebbutt-street-leichhardt-nsw-2040-14536137,440,9/59 Tebbutt Street Leichhardt NSW 2040,2,,0,"Available from<!-- --> <strong>Saturday, 10th October 2020</strong></li><li>Bond<!-- --> <strong>$1880</strong></li></ul>",1880,"Pole Position!! Everything you need in this well-appointed apartment located within moments to the many conveniences offered in Leichhardt. Apartment is in a block of 12 offering light filled living, opens to a sunny balcony with a lovely district outlook. Wonderfully convenient &amp; spacious &amp; perfect entry into the coveted Leichhardt market * Generous bedrooms * Both Bedrooms with wardrobes * Separate kitchen with plenty of storage cupboards, combined living &amp; dining, plus storage  * Pristine bathroom with laundry facilities  * Parquetry floors, security block, close to light rail, city bound buses  Local Schools:  Kegworth Public School - Tebbutt St, Leichhardt Leichhardt Public School - Norton St, Leichhardt St Columba\'s Primary School- Elswick St, Leichhardt St Fiacres Primary Schools - Catherine St, Leichhardt Sydney Secondary College - Balmain R, Leichhardt Bus Transport: To City - 438 - Marion Street 461 - Parramatta Road ","['Balcony / Deck', 'Built in wardrobes']",28,31,26,15,55,63,37,57,43,20 to 39,"14,625"
